Title,URL,Product Price,Stars
The Shadow Hero (The Shadow Hero),https://books.toscrape.com/catalogue/the-shadow-hero-the-shadow-hero_860/index.html,£33.14,One
The Secret (The Secret #1),https://books.toscrape.com/catalogue/the-secret-the-secret-1_859/index.html,£27.37,Four
The Regional Office Is Under Attack!,https://books.toscrape.com/catalogue/the-regional-office-is-under-attack_858/index.html,£51.36,Five
The Psychopath Test: A Journey Through the Madness Industry,https://books.toscrape.com/catalogue/the-psychopath-test-a-journey-through-the-madness-industry_857/index.html,£36.00,Two
The Project,https://books.toscrape.com/catalogue/the-project_856/index.html,£10.65,One
The Power of Now: A Guide to Spiritual Enlightenment,https://books.toscrape.com/catalogue/the-power-of-now-a-guide-to-spiritual-enlightenment_855/index.html,£43.54,Two
The Omnivore's Dilemma: A Natural History of Four Meals,https://books.toscrape.com/catalogue/the-omnivores-dilemma-a-natural-history-of-four-meals_854/index.html,£38.21,Two
The Nerdy Nummies Cookbook: Sweet Treats for the Geek in All of Us,https://books.toscrape.com/catalogue/the-nerdy-nummies-cookbook-sweet-treats-for-the-geek-in-all-of-us_853/index.html,£37.34,Five
The Murder of Roger Ackroyd (Hercule Poirot #4),https://books.toscrape.com/catalogue/the-murder-of-roger-ackroyd-hercule-poirot-4_852/index.html,£44.10,Four
The Mistake (Off-Campus #2),https://books.toscrape.com/catalogue/the-mistake-off-campus-2_851/index.html,£43.29,Three
The Matchmaker's Playbook (Wingmen Inc. #1),https://books.toscrape.com/catalogue/the-matchmakers-playbook-wingmen-inc-1_850/index.html,£55.85,One
The Love and Lemons Cookbook: An Apple-to-Zucchini Celebration of Impromptu Cooking,https://books.toscrape.com/catalogue/the-love-and-lemons-cookbook-an-apple-to-zucchini-celebration-of-impromptu-cooking_849/index.html,£37.60,Two
The Long Shadow of Small Ghosts: Murder and Memory in an American City,https://books.toscrape.com/catalogue/the-long-shadow-of-small-ghosts-murder-and-memory-in-an-american-city_848/index.html,£10.97,One
The Kite Runner,https://books.toscrape.com/catalogue/the-kite-runner_847/index.html,£41.82,Four
The House by the Lake,https://books.toscrape.com/catalogue/the-house-by-the-lake_846/index.html,£36.95,One
The Glittering Court (The Glittering Court #1),https://books.toscrape.com/catalogue/the-glittering-court-the-glittering-court-1_845/index.html,£44.28,One
The Girl on the Train,https://books.toscrape.com/catalogue/the-girl-on-the-train_844/index.html,£55.02,Two
The Genius of Birds,https://books.toscrape.com/catalogue/the-genius-of-birds_843/index.html,£17.24,One
The Emerald Mystery,https://books.toscrape.com/catalogue/the-emerald-mystery_842/index.html,£23.15,Two
The Cookies & Cups Cookbook: 125+ sweet & savory recipes reminding you to Always Eat Dessert First,https://books.toscrape.com/catalogue/the-cookies-cups-cookbook-125-sweet-savory-recipes-reminding-you-to-always-eat-dessert-first_841/index.html,£41.25,One
A Light in the Attic,https://books.toscrape.com/catalogue/a-light-in-the-attic_1000/index.html,£51.77,Three
Tipping the Velvet,https://books.toscrape.com/catalogue/tipping-the-velvet_999/index.html,£53.74,One
Soumission,https://books.toscrape.com/catalogue/soumission_998/index.html,£50.10,One
Sharp Objects,https://books.toscrape.com/catalogue/sharp-objects_997/index.html,£47.82,Four
Sapiens: A Brief History of Humankind,https://books.toscrape.com/catalogue/sapiens-a-brief-history-of-humankind_996/index.html,£54.23,Five
The Requiem Red,https://books.toscrape.com/catalogue/the-requiem-red_995/index.html,£22.65,One
The Dirty Little Secrets of Getting Your Dream Job,https://books.toscrape.com/catalogue/the-dirty-little-secrets-of-getting-your-dream-job_994/index.html,£33.34,Four
"The Coming Woman: A Novel Based on the Life of the Infamous Feminist, Victoria Woodhull",https://books.toscrape.com/catalogue/the-coming-woman-a-novel-based-on-the-life-of-the-infamous-feminist-victoria-woodhull_993/index.html,£17.93,Three
The Boys in the Boat: Nine Americans and Their Epic Quest for Gold at the 1936 Berlin Olympics,https://books.toscrape.com/catalogue/the-boys-in-the-boat-nine-americans-and-their-epic-quest-for-gold-at-the-1936-berlin-olympics_992/index.html,£22.60,Four
The Black Maria,https://books.toscrape.com/catalogue/the-black-maria_991/index.html,£52.15,One
"Starving Hearts (Triangular Trade Trilogy, #1)",https://books.toscrape.com/catalogue/starving-hearts-triangular-trade-trilogy-1_990/index.html,£13.99,Two
Shakespeare's Sonnets,https://books.toscrape.com/catalogue/shakespeares-sonnets_989/index.html,£20.66,Four
Set Me Free,https://books.toscrape.com/catalogue/set-me-free_988/index.html,£17.46,Five
Scott Pilgrim's Precious Little Life (Scott Pilgrim #1),https://books.toscrape.com/catalogue/scott-pilgrims-precious-little-life-scott-pilgrim-1_987/index.html,£52.29,Five
Rip it Up and Start Again,https://books.toscrape.com/catalogue/rip-it-up-and-start-again_986/index.html,£35.02,Five
"Our Band Could Be Your Life: Scenes from the American Indie Underground, 1981-1991",https://books.toscrape.com/catalogue/our-band-could-be-your-life-scenes-from-the-american-indie-underground-1981-1991_985/index.html,£57.25,Three
Olio,https://books.toscrape.com/catalogue/olio_984/index.html,£23.88,One
Mesaerion: The Best Science Fiction Stories 1800-1849,https://books.toscrape.com/catalogue/mesaerion-the-best-science-fiction-stories-1800-1849_983/index.html,£37.59,One
Libertarianism for Beginners,https://books.toscrape.com/catalogue/libertarianism-for-beginners_982/index.html,£51.33,Two
It's Only the Himalayas,https://books.toscrape.com/catalogue/its-only-the-himalayas_981/index.html,£45.17,Two
Seven Days in the Art World,https://books.toscrape.com/catalogue/seven-days-in-the-art-world_220/index.html,£52.33,Two
Seven Brief Lessons on Physics,https://books.toscrape.com/catalogue/seven-brief-lessons-on-physics_219/index.html,£30.60,Four
Scarlet (The Lunar Chronicles #2),https://books.toscrape.com/catalogue/scarlet-the-lunar-chronicles-2_218/index.html,£14.57,Four
Sarah's Key,https://books.toscrape.com/catalogue/sarahs-key_217/index.html,£46.29,One
"Saga, Volume 3 (Saga (Collected Editions) #3)",https://books.toscrape.com/catalogue/saga-volume-3-saga-collected-editions-3_216/index.html,£21.57,Five
Running with Scissors,https://books.toscrape.com/catalogue/running-with-scissors_215/index.html,£12.91,Four
Rogue Lawyer (Rogue Lawyer #1),https://books.toscrape.com/catalogue/rogue-lawyer-rogue-lawyer-1_214/index.html,£50.11,Three
"Rise of the Rocket Girls: The Women Who Propelled Us, from Missiles to the Moon to Mars",https://books.toscrape.com/catalogue/rise-of-the-rocket-girls-the-women-who-propelled-us-from-missiles-to-the-moon-to-mars_213/index.html,£41.67,Four
Rework,https://books.toscrape.com/catalogue/rework_212/index.html,£44.88,Two
Reservations for Two,https://books.toscrape.com/catalogue/reservations-for-two_211/index.html,£11.10,Three
Red: The True Story of Red Riding Hood,https://books.toscrape.com/catalogue/red-the-true-story-of-red-riding-hood_210/index.html,£28.54,Three
Ready Player One,https://books.toscrape.com/catalogue/ready-player-one_209/index.html,£19.07,Four
Quiet: The Power of Introverts in a World That Can't Stop Talking,https://books.toscrape.com/catalogue/quiet-the-power-of-introverts-in-a-world-that-cant-stop-talking_208/index.html,£43.55,One
Prodigy: The Graphic Novel (Legend: The Graphic Novel #2),https://books.toscrape.com/catalogue/prodigy-the-graphic-novel-legend-the-graphic-novel-2_207/index.html,£43.63,Three
Persepolis: The Story of a Childhood (Persepolis #1-2),https://books.toscrape.com/catalogue/persepolis-the-story-of-a-childhood-persepolis-1-2_206/index.html,£39.13,One
Packing for Mars: The Curious Science of Life in the Void,https://books.toscrape.com/catalogue/packing-for-mars-the-curious-science-of-life-in-the-void_205/index.html,£56.68,Two
Outliers: The Story of Success,https://books.toscrape.com/catalogue/outliers-the-story-of-success_204/index.html,£14.16,One
Original Fake,https://books.toscrape.com/catalogue/original-fake_203/index.html,£31.45,Three
Orange Is the New Black,https://books.toscrape.com/catalogue/orange-is-the-new-black_202/index.html,£24.61,Two
One for the Money (Stephanie Plum #1),https://books.toscrape.com/catalogue/one-for-the-money-stephanie-plum-1_201/index.html,£32.87,Two
The Bhagavad Gita,https://books.toscrape.com/catalogue/the-bhagavad-gita_60/index.html,£57.49,Three
The Bette Davis Club,https://books.toscrape.com/catalogue/the-bette-davis-club_59/index.html,£30.66,Three
The Art of Not Breathing,https://books.toscrape.com/catalogue/the-art-of-not-breathing_58/index.html,£40.83,Four
Taking Shots (Assassins #1),https://books.toscrape.com/catalogue/taking-shots-assassins-1_57/index.html,£18.88,Two
Starlark,https://books.toscrape.com/catalogue/starlark_56/index.html,£25.83,Three
"Skip Beat!, Vol. 01 (Skip Beat! #1)",https://books.toscrape.com/catalogue/skip-beat-vol-01-skip-beat-1_55/index.html,£42.12,Three
Sister Sable (The Mad Queen #1),https://books.toscrape.com/catalogue/sister-sable-the-mad-queen-1_54/index.html,£13.33,Three
Shatter Me (Shatter Me #1),https://books.toscrape.com/catalogue/shatter-me-shatter-me-1_53/index.html,£42.40,One
Shameless,https://books.toscrape.com/catalogue/shameless_52/index.html,£58.35,Three
Shadow Rites (Jane Yellowrock #10),https://books.toscrape.com/catalogue/shadow-rites-jane-yellowrock-10_51/index.html,£21.72,Four
Settling the Score (The Summer Games #1),https://books.toscrape.com/catalogue/settling-the-score-the-summer-games-1_50/index.html,£44.91,Two
Sense and Sensibility,https://books.toscrape.com/catalogue/sense-and-sensibility_49/index.html,£37.46,One
"Saga, Volume 1 (Saga (Collected Editions) #1)",https://books.toscrape.com/catalogue/saga-volume-1-saga-collected-editions-1_48/index.html,£28.48,One
"Rhythm, Chord & Malykhin",https://books.toscrape.com/catalogue/rhythm-chord-malykhin_47/index.html,£28.34,Two
"Rat Queens, Vol. 1: Sass & Sorcery (Rat Queens (Collected Editions) #1-5)",https://books.toscrape.com/catalogue/rat-queens-vol-1-sass-sorcery-rat-queens-collected-editions-1-5_46/index.html,£46.96,Five
Paradise Lost (Paradise #1),https://books.toscrape.com/catalogue/paradise-lost-paradise-1_45/index.html,£24.96,One
"Paper Girls, Vol. 1 (Paper Girls #1-5)",https://books.toscrape.com/catalogue/paper-girls-vol-1-paper-girls-1-5_44/index.html,£21.71,Four
"Ouran High School Host Club, Vol. 1 (Ouran High School Host Club #1)",https://books.toscrape.com/catalogue/ouran-high-school-host-club-vol-1-ouran-high-school-host-club-1_43/index.html,£29.87,Three
Origins (Alphas 0.5),https://books.toscrape.com/catalogue/origins-alphas-05_42/index.html,£28.99,One
One Second (Seven #7),https://books.toscrape.com/catalogue/one-second-seven-7_41/index.html,£52.94,Two
Isla and the Happily Ever After (Anna and the French Kiss #3),https://books.toscrape.com/catalogue/isla-and-the-happily-ever-after-anna-and-the-french-kiss-3_380/index.html,£48.13,Five
If I Stay (If I Stay #1),https://books.toscrape.com/catalogue/if-i-stay-if-i-stay-1_379/index.html,£38.13,Five
I Know Why the Caged Bird Sings (Maya Angelou's Autobiography #1),https://books.toscrape.com/catalogue/i-know-why-the-caged-bird-sings-maya-angelous-autobiography-1_378/index.html,£36.55,Two
Harry Potter and the Deathly Hallows (Harry Potter #7),https://books.toscrape.com/catalogue/harry-potter-and-the-deathly-hallows-harry-potter-7_377/index.html,£23.32,One
"Fruits Basket, Vol. 5 (Fruits Basket #5)",https://books.toscrape.com/catalogue/fruits-basket-vol-5-fruits-basket-5_376/index.html,£16.33,One
Foundation (Foundation (Publication Order) #1),https://books.toscrape.com/catalogue/foundation-foundation-publication-order-1_375/index.html,£32.42,One
Fool Me Once,https://books.toscrape.com/catalogue/fool-me-once_374/index.html,£16.96,One
Find Her (Detective D.D. Warren #8),https://books.toscrape.com/catalogue/find-her-detective-dd-warren-8_373/index.html,£22.37,One
Evicted: Poverty and Profit in the American City,https://books.toscrape.com/catalogue/evicted-poverty-and-profit-in-the-american-city_372/index.html,£42.27,One
Drama,https://books.toscrape.com/catalogue/drama_371/index.html,£38.70,Two
Dracula the Un-Dead,https://books.toscrape.com/catalogue/dracula-the-un-dead_370/index.html,£35.63,Five
Digital Fortress,https://books.toscrape.com/catalogue/digital-fortress_369/index.html,£58.00,Five
"Death Note, Vol. 5: Whiteout (Death Note #5)",https://books.toscrape.com/catalogue/death-note-vol-5-whiteout-death-note-5_368/index.html,£52.41,One
"Data, A Love Story: How I Gamed Online Dating to Meet My Match",https://books.toscrape.com/catalogue/data-a-love-story-how-i-gamed-online-dating-to-meet-my-match_367/index.html,£32.35,Three
Critique of Pure Reason,https://books.toscrape.com/catalogue/critique-of-pure-reason_366/index.html,£20.75,One
Booked,https://books.toscrape.com/catalogue/booked_365/index.html,£17.49,Five
"Blue Lily, Lily Blue (The Raven Cycle #3)",https://books.toscrape.com/catalogue/blue-lily-lily-blue-the-raven-cycle-3_364/index.html,£34.13,Five
Approval Junkie: Adventures in Caring Too Much,https://books.toscrape.com/catalogue/approval-junkie-adventures-in-caring-too-much_363/index.html,£58.81,Five
An Abundance of Katherines,https://books.toscrape.com/catalogue/an-abundance-of-katherines_362/index.html,£10.00,Five
America's War for the Greater Middle East: A Military History,https://books.toscrape.com/catalogue/americas-war-for-the-greater-middle-east-a-military-history_361/index.html,£51.22,Two
Immunity: How Elie Metchnikoff Changed the Course of Modern Medicine,https://books.toscrape.com/catalogue/immunity-how-elie-metchnikoff-changed-the-course-of-modern-medicine_900/index.html,£57.36,Five
"I Hate Fairyland, Vol. 1: Madly Ever After (I Hate Fairyland (Compilations) #1-5)",https://books.toscrape.com/catalogue/i-hate-fairyland-vol-1-madly-ever-after-i-hate-fairyland-compilations-1-5_899/index.html,£29.17,Two
I am a Hero Omnibus Volume 1,https://books.toscrape.com/catalogue/i-am-a-hero-omnibus-volume-1_898/index.html,£54.63,Three
How to Be Miserable: 40 Strategies You Already Use,https://books.toscrape.com/catalogue/how-to-be-miserable-40-strategies-you-already-use_897/index.html,£46.03,One
Her Backup Boyfriend (The Sorensen Family #1),https://books.toscrape.com/catalogue/her-backup-boyfriend-the-sorensen-family-1_896/index.html,£33.97,One
"Giant Days, Vol. 2 (Giant Days #5-8)",https://books.toscrape.com/catalogue/giant-days-vol-2-giant-days-5-8_895/index.html,£22.11,Two
Forever and Forever: The Courtship of Henry Longfellow and Fanny Appleton,https://books.toscrape.com/catalogue/forever-and-forever-the-courtship-of-henry-longfellow-and-fanny-appleton_894/index.html,£29.69,Three
First and First (Five Boroughs #3),https://books.toscrape.com/catalogue/first-and-first-five-boroughs-3_893/index.html,£15.97,Four
Fifty Shades Darker (Fifty Shades #2),https://books.toscrape.com/catalogue/fifty-shades-darker-fifty-shades-2_892/index.html,£21.96,One
Everydata: The Misinformation Hidden in the Little Data You Consume Every Day,https://books.toscrape.com/catalogue/everydata-the-misinformation-hidden-in-the-little-data-you-consume-every-day_891/index.html,£54.35,Two
"Don't Be a Jerk: And Other Practical Advice from Dogen, Japan's Greatest Zen Master",https://books.toscrape.com/catalogue/dont-be-a-jerk-and-other-practical-advice-from-dogen-japans-greatest-zen-master_890/index.html,£37.97,Two
Danganronpa Volume 1,https://books.toscrape.com/catalogue/danganronpa-volume-1_889/index.html,£51.99,Four
Crown of Midnight (Throne of Glass #2),https://books.toscrape.com/catalogue/crown-of-midnight-throne-of-glass-2_888/index.html,£43.29,Three
"Codename Baboushka, Volume 1: The Conclave of Death",https://books.toscrape.com/catalogue/codename-baboushka-volume-1-the-conclave-of-death_887/index.html,£36.72,Four
Camp Midnight,https://books.toscrape.com/catalogue/camp-midnight_886/index.html,£17.08,Four
Call the Nurse: True Stories of a Country Nurse on a Scottish Isle,https://books.toscrape.com/catalogue/call-the-nurse-true-stories-of-a-country-nurse-on-a-scottish-isle_885/index.html,£29.14,Five
Burning,https://books.toscrape.com/catalogue/burning_884/index.html,£28.81,Three
Bossypants,https://books.toscrape.com/catalogue/bossypants_883/index.html,£49.46,Two
"Bitch Planet, Vol. 1: Extraordinary Machine (Bitch Planet (Collected Editions))",https://books.toscrape.com/catalogue/bitch-planet-vol-1-extraordinary-machine-bitch-planet-collected-editions_882/index.html,£37.92,Two
"Avatar: The Last Airbender: Smoke and Shadow, Part 3 (Smoke and Shadow #3)",https://books.toscrape.com/catalogue/avatar-the-last-airbender-smoke-and-shadow-part-3-smoke-and-shadow-3_881/index.html,£28.09,Two
Benjamin Franklin: An American Life,https://books.toscrape.com/catalogue/benjamin-franklin-an-american-life_460/index.html,£48.19,Three
"At The Existentialist Café: Freedom, Being, and apricot cocktails with: Jean-Paul Sartre, Simone de Beauvoir, Albert Camus, Martin Heidegger, Edmund Husserl, Karl Jaspers, Maurice Merleau-Ponty and others",https://books.toscrape.com/catalogue/at-the-existentialist-cafe-freedom-being-and-apricot-cocktails-with-jean-paul-sartre-simone-de-beauvoir-albert-camus-martin-heidegger-edmund-husserl-karl-jaspers-maurice-merleau-ponty-and-others_459/index.html,£29.93,Five
A Summer In Europe,https://books.toscrape.com/catalogue/a-summer-in-europe_458/index.html,£44.34,Two
A Short History of Nearly Everything,https://books.toscrape.com/catalogue/a-short-history-of-nearly-everything_457/index.html,£52.40,Five
A Gathering of Shadows (Shades of Magic #2),https://books.toscrape.com/catalogue/a-gathering-of-shadows-shades-of-magic-2_456/index.html,£44.81,Four
The Sound Of Love,https://books.toscrape.com/catalogue/the-sound-of-love_455/index.html,£57.84,Five
The Rise and Fall of the Third Reich: A History of Nazi Germany,https://books.toscrape.com/catalogue/the-rise-and-fall-of-the-third-reich-a-history-of-nazi-germany_454/index.html,£39.67,Two
The Perks of Being a Wallflower,https://books.toscrape.com/catalogue/the-perks-of-being-a-wallflower_453/index.html,£55.02,Three
The Mysterious Affair at Styles (Hercule Poirot #1),https://books.toscrape.com/catalogue/the-mysterious-affair-at-styles-hercule-poirot-1_452/index.html,£24.80,Four
The Man Who Mistook His Wife for a Hat and Other Clinical Tales,https://books.toscrape.com/catalogue/the-man-who-mistook-his-wife-for-a-hat-and-other-clinical-tales_451/index.html,£59.45,Four
The Makings of a Fatherless Child,https://books.toscrape.com/catalogue/the-makings-of-a-fatherless-child_450/index.html,£31.58,Two
The Joy of Cooking,https://books.toscrape.com/catalogue/the-joy-of-cooking_449/index.html,£43.27,Four
The Invention of Wings,https://books.toscrape.com/catalogue/the-invention-of-wings_448/index.html,£37.34,One
The Hobbit (Middle-Earth Universe),https://books.toscrape.com/catalogue/the-hobbit-middle-earth-universe_447/index.html,£17.80,Five
The Great Railway Bazaar,https://books.toscrape.com/catalogue/the-great-railway-bazaar_446/index.html,£30.54,One
The Golden Compass (His Dark Materials #1),https://books.toscrape.com/catalogue/the-golden-compass-his-dark-materials-1_445/index.html,£18.77,One
The God Delusion,https://books.toscrape.com/catalogue/the-god-delusion_444/index.html,£46.85,Three
The Girl You Left Behind (The Girl You Left Behind #1),https://books.toscrape.com/catalogue/the-girl-you-left-behind-the-girl-you-left-behind-1_443/index.html,£15.79,One
The Fellowship of the Ring (The Lord of the Rings #1),https://books.toscrape.com/catalogue/the-fellowship-of-the-ring-the-lord-of-the-rings-1_442/index.html,£10.27,Two
The Collected Poems of W.B. Yeats (The Collected Works of W.B. Yeats #1),https://books.toscrape.com/catalogue/the-collected-poems-of-wb-yeats-the-collected-works-of-wb-yeats-1_441/index.html,£15.42,Five
Slow States of Collapse: Poems,https://books.toscrape.com/catalogue/slow-states-of-collapse-poems_960/index.html,£57.31,Three
Reasons to Stay Alive,https://books.toscrape.com/catalogue/reasons-to-stay-alive_959/index.html,£26.41,Two
Private Paris (Private #10),https://books.toscrape.com/catalogue/private-paris-private-10_958/index.html,£47.61,Five
#HigherSelfie: Wake Up Your Life. Free Your Soul. Find Your Tribe.,https://books.toscrape.com/catalogue/higherselfie-wake-up-your-life-free-your-soul-find-your-tribe_957/index.html,£23.11,Five
Without Borders (Wanderlove #1),https://books.toscrape.com/catalogue/without-borders-wanderlove-1_956/index.html,£45.07,Two
When We Collided,https://books.toscrape.com/catalogue/when-we-collided_955/index.html,£31.77,One
"We Love You, Charlie Freeman",https://books.toscrape.com/catalogue/we-love-you-charlie-freeman_954/index.html,£50.27,Five
Untitled Collection: Sabbath Poems 2014,https://books.toscrape.com/catalogue/untitled-collection-sabbath-poems-2014_953/index.html,£14.27,Four
"Unseen City: The Majesty of Pigeons, the Discreet Charm of Snails & Other Wonders of the Urban Wilderness",https://books.toscrape.com/catalogue/unseen-city-the-majesty-of-pigeons-the-discreet-charm-of-snails-other-wonders-of-the-urban-wilderness_952/index.html,£44.18,Four
Unicorn Tracks,https://books.toscrape.com/catalogue/unicorn-tracks_951/index.html,£18.78,Three
"Unbound: How Eight Technologies Made Us Human, Transformed Society, and Brought Our World to the Brink",https://books.toscrape.com/catalogue/unbound-how-eight-technologies-made-us-human-transformed-society-and-brought-our-world-to-the-brink_950/index.html,£25.52,One
Tsubasa: WoRLD CHRoNiCLE 2 (Tsubasa WoRLD CHRoNiCLE #2),https://books.toscrape.com/catalogue/tsubasa-world-chronicle-2-tsubasa-world-chronicle-2_949/index.html,£16.28,One
Throwing Rocks at the Google Bus: How Growth Became the Enemy of Prosperity,https://books.toscrape.com/catalogue/throwing-rocks-at-the-google-bus-how-growth-became-the-enemy-of-prosperity_948/index.html,£31.12,Three
This One Summer,https://books.toscrape.com/catalogue/this-one-summer_947/index.html,£19.49,Four
Thirst,https://books.toscrape.com/catalogue/thirst_946/index.html,£17.27,Five
The Torch Is Passed: A Harding Family Story,https://books.toscrape.com/catalogue/the-torch-is-passed-a-harding-family-story_945/index.html,£19.09,One
The Secret of Dreadwillow Carse,https://books.toscrape.com/catalogue/the-secret-of-dreadwillow-carse_944/index.html,£56.13,One
"The Pioneer Woman Cooks: Dinnertime: Comfort Classics, Freezer Food, 16-Minute Meals, and Other Delicious Ways to Solve Supper!",https://books.toscrape.com/catalogue/the-pioneer-woman-cooks-dinnertime-comfort-classics-freezer-food-16-minute-meals-and-other-delicious-ways-to-solve-supper_943/index.html,£56.41,One
The Past Never Ends,https://books.toscrape.com/catalogue/the-past-never-ends_942/index.html,£56.50,Four
The Natural History of Us (The Fine Art of Pretending #2),https://books.toscrape.com/catalogue/the-natural-history-of-us-the-fine-art-of-pretending-2_941/index.html,£45.22,Three
The Story of Art,https://books.toscrape.com/catalogue/the-story-of-art_500/index.html,£41.14,Four
The Origin of Species,https://books.toscrape.com/catalogue/the-origin-of-species_499/index.html,£10.01,Four
The Great Gatsby,https://books.toscrape.com/catalogue/the-great-gatsby_498/index.html,£36.05,Four
The Good Girl,https://books.toscrape.com/catalogue/the-good-girl_497/index.html,£49.03,Three
The Glass Castle,https://books.toscrape.com/catalogue/the-glass-castle_496/index.html,£16.24,One
The Faith of Christopher Hitchens: The Restless Soul of the World's Most Notorious Atheist,https://books.toscrape.com/catalogue/the-faith-of-christopher-hitchens-the-restless-soul-of-the-worlds-most-notorious-atheist_495/index.html,£39.55,One
The Drowning Girls,https://books.toscrape.com/catalogue/the-drowning-girls_494/index.html,£35.67,Three
The Constant Princess (The Tudor Court #1),https://books.toscrape.com/catalogue/the-constant-princess-the-tudor-court-1_493/index.html,£16.62,Three
The Bourne Identity (Jason Bourne #1),https://books.toscrape.com/catalogue/the-bourne-identity-jason-bourne-1_492/index.html,£42.78,Four
The Bachelor Girl's Guide to Murder (Herringford and Watts Mysteries #1),https://books.toscrape.com/catalogue/the-bachelor-girls-guide-to-murder-herringford-and-watts-mysteries-1_491/index.html,£52.30,Five
The Art Book,https://books.toscrape.com/catalogue/the-art-book_490/index.html,£32.34,Two
The 7 Habits of Highly Effective People: Powerful Lessons in Personal Change,https://books.toscrape.com/catalogue/the-7-habits-of-highly-effective-people-powerful-lessons-in-personal-change_489/index.html,£33.17,Four
Team of Rivals: The Political Genius of Abraham Lincoln,https://books.toscrape.com/catalogue/team-of-rivals-the-political-genius-of-abraham-lincoln_488/index.html,£20.12,Five
Steal Like an Artist: 10 Things Nobody Told You About Being Creative,https://books.toscrape.com/catalogue/steal-like-an-artist-10-things-nobody-told-you-about-being-creative_487/index.html,£20.90,Two
"Sit, Stay, Love",https://books.toscrape.com/catalogue/sit-stay-love_486/index.html,£20.90,Three
Sister Dear,https://books.toscrape.com/catalogue/sister-dear_485/index.html,£40.20,Four
"Shrunken Treasures: Literary Classics, Short, Sweet, and Silly",https://books.toscrape.com/catalogue/shrunken-treasures-literary-classics-short-sweet-and-silly_484/index.html,£52.87,Three
"Rich Dad, Poor Dad",https://books.toscrape.com/catalogue/rich-dad-poor-dad_483/index.html,£51.74,One
