Title,URL,Product Price,Stars
Raymie Nightingale,https://books.toscrape.com/catalogue/raymie-nightingale_482/index.html,£34.41,Two
Playing from the Heart,https://books.toscrape.com/catalogue/playing-from-the-heart_481/index.html,£32.38,One
Civilization and Its Discontents,https://books.toscrape.com/catalogue/civilization-and-its-discontents_140/index.html,£59.95,Two
Cinder (The Lunar Chronicles #1),https://books.toscrape.com/catalogue/cinder-the-lunar-chronicles-1_139/index.html,£26.09,One
Catastrophic Happiness: Finding Joy in Childhood's Messy Years,https://books.toscrape.com/catalogue/catastrophic-happiness-finding-joy-in-childhoods-messy-years_138/index.html,£37.35,Two
Career of Evil (Cormoran Strike #3),https://books.toscrape.com/catalogue/career-of-evil-cormoran-strike-3_137/index.html,£24.72,Two
Breaking Dawn (Twilight #4),https://books.toscrape.com/catalogue/breaking-dawn-twilight-4_136/index.html,£35.28,Five
Brave Enough,https://books.toscrape.com/catalogue/brave-enough_135/index.html,£51.32,Five
Boy Meets Boy,https://books.toscrape.com/catalogue/boy-meets-boy_134/index.html,£21.12,Three
"Born to Run: A Hidden Tribe, Superathletes, and the Greatest Race the World Has Never Seen",https://books.toscrape.com/catalogue/born-to-run-a-hidden-tribe-superathletes-and-the-greatest-race-the-world-has-never-seen_133/index.html,£27.35,Two
Blink: The Power of Thinking Without Thinking,https://books.toscrape.com/catalogue/blink-the-power-of-thinking-without-thinking_132/index.html,£21.74,Five
Black Flags: The Rise of ISIS,https://books.toscrape.com/catalogue/black-flags-the-rise-of-isis_131/index.html,£40.87,One
"Black Butler, Vol. 1 (Black Butler #1)",https://books.toscrape.com/catalogue/black-butler-vol-1-black-butler-1_130/index.html,£49.31,One
Big Little Lies,https://books.toscrape.com/catalogue/big-little-lies_129/index.html,£22.11,One
Between Shades of Gray,https://books.toscrape.com/catalogue/between-shades-of-gray_128/index.html,£20.79,Five
Best of My Love (Fool's Gold #20),https://books.toscrape.com/catalogue/best-of-my-love-fools-gold-20_127/index.html,£27.41,Two
Beowulf,https://books.toscrape.com/catalogue/beowulf_126/index.html,£38.35,Two
Beautiful Creatures (Caster Chronicles #1),https://books.toscrape.com/catalogue/beautiful-creatures-caster-chronicles-1_125/index.html,£21.55,Five
Awkward,https://books.toscrape.com/catalogue/awkward_124/index.html,£38.02,Two
Ash,https://books.toscrape.com/catalogue/ash_123/index.html,£22.06,Four
Are We There Yet?,https://books.toscrape.com/catalogue/are-we-there-yet_122/index.html,£10.66,Three
Are We Smart Enough to Know How Smart Animals Are?,https://books.toscrape.com/catalogue/are-we-smart-enough-to-know-how-smart-animals-are_121/index.html,£56.58,One
Heaven is for Real: A Little Boy's Astounding Story of His Trip to Heaven and Back,https://books.toscrape.com/catalogue/heaven-is-for-real-a-little-boys-astounding-story-of-his-trip-to-heaven-and-back_520/index.html,£52.86,Two
Future Shock (Future Shock #1),https://books.toscrape.com/catalogue/future-shock-future-shock-1_519/index.html,£55.65,Five
Ender's Game (The Ender Quintet #1),https://books.toscrape.com/catalogue/enders-game-the-ender-quintet-1_518/index.html,£43.64,One
Diary of a Citizen Scientist: Chasing Tiger Beetles and Other New Ways of Engaging the World,https://books.toscrape.com/catalogue/diary-of-a-citizen-scientist-chasing-tiger-beetles-and-other-new-ways-of-engaging-the-world_517/index.html,£28.41,One
Death by Leisure: A Cautionary Tale,https://books.toscrape.com/catalogue/death-by-leisure-a-cautionary-tale_516/index.html,£37.51,Four
Brilliant Beacons: A History of the American Lighthouse,https://books.toscrape.com/catalogue/brilliant-beacons-a-history-of-the-american-lighthouse_515/index.html,£11.45,Three
Brazen: The Courage to Find the You That's Been Hiding,https://books.toscrape.com/catalogue/brazen-the-courage-to-find-the-you-thats-been-hiding_514/index.html,£19.22,Two
Between the World and Me,https://books.toscrape.com/catalogue/between-the-world-and-me_513/index.html,£56.91,Four
Being Mortal: Medicine and What Matters in the End,https://books.toscrape.com/catalogue/being-mortal-medicine-and-what-matters-in-the-end_512/index.html,£55.06,Four
"A Murder Over a Girl: Justice, Gender, Junior High",https://books.toscrape.com/catalogue/a-murder-over-a-girl-justice-gender-junior-high_511/index.html,£13.20,Three
32 Yolks,https://books.toscrape.com/catalogue/32-yolks_510/index.html,£53.63,Two
"""Most Blessed of the Patriarchs"": Thomas Jefferson and the Empire of the Imagination",https://books.toscrape.com/catalogue/most-blessed-of-the-patriarchs-thomas-jefferson-and-the-empire-of-the-imagination_509/index.html,£44.48,Five
You Are a Badass: How to Stop Doubting Your Greatness and Start Living an Awesome Life,https://books.toscrape.com/catalogue/you-are-a-badass-how-to-stop-doubting-your-greatness-and-start-living-an-awesome-life_508/index.html,£12.08,Three
Wildlife of New York: A Five-Borough Coloring Book,https://books.toscrape.com/catalogue/wildlife-of-new-york-a-five-borough-coloring-book_507/index.html,£22.14,Two
What Happened on Beale Street (Secrets of the South Mysteries #2),https://books.toscrape.com/catalogue/what-happened-on-beale-street-secrets-of-the-south-mysteries-2_506/index.html,£25.37,Five
Unreasonable Hope: Finding Faith in the God Who Brings Purpose to Your Pain,https://books.toscrape.com/catalogue/unreasonable-hope-finding-faith-in-the-god-who-brings-purpose-to-your-pain_505/index.html,£46.33,Two
Under the Tuscan Sun,https://books.toscrape.com/catalogue/under-the-tuscan-sun_504/index.html,£37.33,Three
Toddlers Are A**holes: It's Not Your Fault,https://books.toscrape.com/catalogue/toddlers-are-aholes-its-not-your-fault_503/index.html,£25.55,One
The Year of Living Biblically: One Man's Humble Quest to Follow the Bible as Literally as Possible,https://books.toscrape.com/catalogue/the-year-of-living-biblically-one-mans-humble-quest-to-follow-the-bible-as-literally-as-possible_502/index.html,£34.72,One
The Whale,https://books.toscrape.com/catalogue/the-whale_501/index.html,£35.96,Four
Algorithms to Live By: The Computer Science of Human Decisions,https://books.toscrape.com/catalogue/algorithms-to-live-by-the-computer-science-of-human-decisions_880/index.html,£30.81,One
A World of Flavor: Your Gluten Free Passport,https://books.toscrape.com/catalogue/a-world-of-flavor-your-gluten-free-passport_879/index.html,£42.95,One
"A Piece of Sky, a Grain of Rice: A Memoir in Four Meditations",https://books.toscrape.com/catalogue/a-piece-of-sky-a-grain-of-rice-a-memoir-in-four-meditations_878/index.html,£56.76,Five
A Murder in Time,https://books.toscrape.com/catalogue/a-murder-in-time_877/index.html,£16.64,One
A Flight of Arrows (The Pathfinders #2),https://books.toscrape.com/catalogue/a-flight-of-arrows-the-pathfinders-2_876/index.html,£55.53,Five
A Fierce and Subtle Poison,https://books.toscrape.com/catalogue/a-fierce-and-subtle-poison_875/index.html,£28.13,Four
A Court of Thorns and Roses (A Court of Thorns and Roses #1),https://books.toscrape.com/catalogue/a-court-of-thorns-and-roses-a-court-of-thorns-and-roses-1_874/index.html,£52.37,One
(Un)Qualified: How God Uses Broken People to Do Big Things,https://books.toscrape.com/catalogue/unqualified-how-god-uses-broken-people-to-do-big-things_873/index.html,£54.00,Five
You Are What You Love: The Spiritual Power of Habit,https://books.toscrape.com/catalogue/you-are-what-you-love-the-spiritual-power-of-habit_872/index.html,£21.87,Four
"William Shakespeare's Star Wars: Verily, A New Hope (William Shakespeare's Star Wars #4)",https://books.toscrape.com/catalogue/william-shakespeares-star-wars-verily-a-new-hope-william-shakespeares-star-wars-4_871/index.html,£43.30,Four
Tuesday Nights in 1980,https://books.toscrape.com/catalogue/tuesday-nights-in-1980_870/index.html,£21.04,Two
Tracing Numbers on a Train,https://books.toscrape.com/catalogue/tracing-numbers-on-a-train_869/index.html,£41.60,Three
Throne of Glass (Throne of Glass #1),https://books.toscrape.com/catalogue/throne-of-glass-throne-of-glass-1_868/index.html,£35.07,Three
Thomas Jefferson and the Tripoli Pirates: The Forgotten War That Changed American History,https://books.toscrape.com/catalogue/thomas-jefferson-and-the-tripoli-pirates-the-forgotten-war-that-changed-american-history_867/index.html,£59.64,One
Thirteen Reasons Why,https://books.toscrape.com/catalogue/thirteen-reasons-why_866/index.html,£52.72,One
The White Cat and the Monk: A Retelling of the Poem “Pangur Bán”,https://books.toscrape.com/catalogue/the-white-cat-and-the-monk-a-retelling-of-the-poem-pangur-ban_865/index.html,£58.08,Four
The Wedding Dress,https://books.toscrape.com/catalogue/the-wedding-dress_864/index.html,£24.12,One
The Vacationers,https://books.toscrape.com/catalogue/the-vacationers_863/index.html,£42.15,Four
The Third Wave: An Entrepreneur’s Vision of the Future,https://books.toscrape.com/catalogue/the-third-wave-an-entrepreneurs-vision-of-the-future_862/index.html,£12.61,Five
The Stranger,https://books.toscrape.com/catalogue/the-stranger_861/index.html,£17.44,Four
On the Road (Duluoz Legend),https://books.toscrape.com/catalogue/on-the-road-duluoz-legend_40/index.html,£32.36,Three
Old Records Never Die: One Man's Quest for His Vinyl and His Past,https://books.toscrape.com/catalogue/old-records-never-die-one-mans-quest-for-his-vinyl-and-his-past_39/index.html,£55.66,Two
Off Sides (Off #1),https://books.toscrape.com/catalogue/off-sides-off-1_38/index.html,£39.45,Five
Of Mice and Men,https://books.toscrape.com/catalogue/of-mice-and-men_37/index.html,£47.11,Two
Myriad (Prentor #1),https://books.toscrape.com/catalogue/myriad-prentor-1_36/index.html,£58.75,Four
My Perfect Mistake (Over the Top #1),https://books.toscrape.com/catalogue/my-perfect-mistake-over-the-top-1_35/index.html,£38.92,Two
"Ms. Marvel, Vol. 1: No Normal (Ms. Marvel (2014-2015) #1)",https://books.toscrape.com/catalogue/ms-marvel-vol-1-no-normal-ms-marvel-2014-2015-1_34/index.html,£39.39,Four
Meditations,https://books.toscrape.com/catalogue/meditations_33/index.html,£25.89,Two
Matilda,https://books.toscrape.com/catalogue/matilda_32/index.html,£28.34,One
Lost Among the Living,https://books.toscrape.com/catalogue/lost-among-the-living_31/index.html,£27.70,Four
Lord of the Flies,https://books.toscrape.com/catalogue/lord-of-the-flies_30/index.html,£24.89,Three
Listen to Me (Fusion #1),https://books.toscrape.com/catalogue/listen-to-me-fusion-1_29/index.html,£58.99,Three
Kitchens of the Great Midwest,https://books.toscrape.com/catalogue/kitchens-of-the-great-midwest_28/index.html,£57.20,Five
Jane Eyre,https://books.toscrape.com/catalogue/jane-eyre_27/index.html,£38.43,Five
Imperfect Harmony,https://books.toscrape.com/catalogue/imperfect-harmony_26/index.html,£34.74,Four
Icing (Aces Hockey #2),https://books.toscrape.com/catalogue/icing-aces-hockey-2_25/index.html,£40.44,Four
"Hawkeye, Vol. 1: My Life as a Weapon (Hawkeye #1)",https://books.toscrape.com/catalogue/hawkeye-vol-1-my-life-as-a-weapon-hawkeye-1_24/index.html,£45.24,Three
Having the Barbarian's Baby (Ice Planet Barbarians #7.5),https://books.toscrape.com/catalogue/having-the-barbarians-baby-ice-planet-barbarians-75_23/index.html,£34.96,Four
"Giant Days, Vol. 1 (Giant Days #1-4)",https://books.toscrape.com/catalogue/giant-days-vol-1-giant-days-1-4_22/index.html,£56.76,Four
"Fruits Basket, Vol. 1 (Fruits Basket #1)",https://books.toscrape.com/catalogue/fruits-basket-vol-1-fruits-basket-1_21/index.html,£40.28,Five
The Dream Thieves (The Raven Cycle #2),https://books.toscrape.com/catalogue/the-dream-thieves-the-raven-cycle-2_400/index.html,£34.50,One
The Darkest Corners,https://books.toscrape.com/catalogue/the-darkest-corners_399/index.html,£11.33,Five
The Crossover,https://books.toscrape.com/catalogue/the-crossover_398/index.html,£38.77,Four
The 5th Wave (The 5th Wave #1),https://books.toscrape.com/catalogue/the-5th-wave-the-5th-wave-1_397/index.html,£11.83,Two
Tell the Wind and Fire,https://books.toscrape.com/catalogue/tell-the-wind-and-fire_396/index.html,£45.51,Three
Tell Me Three Things,https://books.toscrape.com/catalogue/tell-me-three-things_395/index.html,£41.81,One
Talking to Girls About Duran Duran: One Young Man's Quest for True Love and a Cooler Haircut,https://books.toscrape.com/catalogue/talking-to-girls-about-duran-duran-one-young-mans-quest-for-true-love-and-a-cooler-haircut_394/index.html,£25.15,Four
Siddhartha,https://books.toscrape.com/catalogue/siddhartha_393/index.html,£34.22,Five
Shiver (The Wolves of Mercy Falls #1),https://books.toscrape.com/catalogue/shiver-the-wolves-of-mercy-falls-1_392/index.html,£16.23,Five
Remember Me?,https://books.toscrape.com/catalogue/remember-me_391/index.html,£11.48,Three
Red Dragon (Hannibal Lecter #1),https://books.toscrape.com/catalogue/red-dragon-hannibal-lecter-1_390/index.html,£23.37,Three
Peak: Secrets from the New Science of Expertise,https://books.toscrape.com/catalogue/peak-secrets-from-the-new-science-of-expertise_389/index.html,£16.28,Two
My Mother Was Nuts,https://books.toscrape.com/catalogue/my-mother-was-nuts_388/index.html,£31.63,Four
Mexican Today: New and Rediscovered Recipes for Contemporary Kitchens,https://books.toscrape.com/catalogue/mexican-today-new-and-rediscovered-recipes-for-contemporary-kitchens_387/index.html,£24.91,Five
Maybe Something Beautiful: How Art Transformed a Neighborhood,https://books.toscrape.com/catalogue/maybe-something-beautiful-how-art-transformed-a-neighborhood_386/index.html,£22.54,One
Lola and the Boy Next Door (Anna and the French Kiss #2),https://books.toscrape.com/catalogue/lola-and-the-boy-next-door-anna-and-the-french-kiss-2_385/index.html,£23.63,Four
Logan Kade (Fallen Crest High #5.5),https://books.toscrape.com/catalogue/logan-kade-fallen-crest-high-55_384/index.html,£13.12,Two
Last One Home (New Beginnings #1),https://books.toscrape.com/catalogue/last-one-home-new-beginnings-1_383/index.html,£59.98,Three
Killing Floor (Jack Reacher #1),https://books.toscrape.com/catalogue/killing-floor-jack-reacher-1_382/index.html,£31.49,Four
Kill the Boy Band,https://books.toscrape.com/catalogue/kill-the-boy-band_381/index.html,£15.52,Five
Whole Lotta Creativity Going On: 60 Fun and Unusual Exercises to Awaken and Strengthen Your Creativity,https://books.toscrape.com/catalogue/whole-lotta-creativity-going-on-60-fun-and-unusual-exercises-to-awaken-and-strengthen-your-creativity_780/index.html,£38.20,Four
What's It Like in Space?: Stories from Astronauts Who've Been There,https://books.toscrape.com/catalogue/whats-it-like-in-space-stories-from-astronauts-whove-been-there_779/index.html,£19.60,Two
"We Are Robin, Vol. 1: The Vigilante Business (We Are Robin #1)",https://books.toscrape.com/catalogue/we-are-robin-vol-1-the-vigilante-business-we-are-robin-1_778/index.html,£53.90,One
Walt Disney's Alice in Wonderland,https://books.toscrape.com/catalogue/walt-disneys-alice-in-wonderland_777/index.html,£12.96,Five
V for Vendetta (V for Vendetta Complete),https://books.toscrape.com/catalogue/v-for-vendetta-v-for-vendetta-complete_776/index.html,£37.10,Four
Until Friday Night (The Field Party #1),https://books.toscrape.com/catalogue/until-friday-night-the-field-party-1_775/index.html,£46.31,Two
"Unbroken: A World War II Story of Survival, Resilience, and Redemption",https://books.toscrape.com/catalogue/unbroken-a-world-war-ii-story-of-survival-resilience-and-redemption_774/index.html,£45.95,Two
Twenty Yawns,https://books.toscrape.com/catalogue/twenty-yawns_773/index.html,£22.08,Two
Through the Woods,https://books.toscrape.com/catalogue/through-the-woods_772/index.html,£25.38,Two
This Is Where It Ends,https://books.toscrape.com/catalogue/this-is-where-it-ends_771/index.html,£27.12,Two
The Year of Magical Thinking,https://books.toscrape.com/catalogue/the-year-of-magical-thinking_770/index.html,£43.04,Two
The Wright Brothers,https://books.toscrape.com/catalogue/the-wright-brothers_769/index.html,£56.80,Four
The White Queen (The Cousins' War #1),https://books.toscrape.com/catalogue/the-white-queen-the-cousins-war-1_768/index.html,£25.91,Five
The Wedding Pact (The O'Malleys #2),https://books.toscrape.com/catalogue/the-wedding-pact-the-omalleys-2_767/index.html,£32.61,Three
The Time Keeper,https://books.toscrape.com/catalogue/the-time-keeper_766/index.html,£27.88,Five
The Testament of Mary,https://books.toscrape.com/catalogue/the-testament-of-mary_765/index.html,£52.67,Four
The Star-Touched Queen,https://books.toscrape.com/catalogue/the-star-touched-queen_764/index.html,£46.02,Five
The Songs of the Gods,https://books.toscrape.com/catalogue/the-songs-of-the-gods_763/index.html,£44.48,Five
The Song of Achilles,https://books.toscrape.com/catalogue/the-song-of-achilles_762/index.html,£37.40,Five
The Rosie Project (Don Tillman #1),https://books.toscrape.com/catalogue/the-rosie-project-don-tillman-1_761/index.html,£54.04,One
Far From True (Promise Falls Trilogy #2),https://books.toscrape.com/catalogue/far-from-true-promise-falls-trilogy-2_320/index.html,£34.93,Two
Dark Lover (Black Dagger Brotherhood #1),https://books.toscrape.com/catalogue/dark-lover-black-dagger-brotherhood-1_319/index.html,£12.87,One
Confessions of a Shopaholic (Shopaholic #1),https://books.toscrape.com/catalogue/confessions-of-a-shopaholic-shopaholic-1_318/index.html,£48.94,Two
Changing the Game (Play by Play #2),https://books.toscrape.com/catalogue/changing-the-game-play-by-play-2_317/index.html,£13.38,Three
Candide,https://books.toscrape.com/catalogue/candide_316/index.html,£58.63,Three
Can You Keep a Secret?,https://books.toscrape.com/catalogue/can-you-keep-a-secret_315/index.html,£21.94,One
Atlas Shrugged,https://books.toscrape.com/catalogue/atlas-shrugged_314/index.html,£26.58,Five
Animal Farm,https://books.toscrape.com/catalogue/animal-farm_313/index.html,£57.22,Three
A Walk to Remember,https://books.toscrape.com/catalogue/a-walk-to-remember_312/index.html,£56.43,One
A New Earth: Awakening to Your Life's Purpose,https://books.toscrape.com/catalogue/a-new-earth-awakening-to-your-lifes-purpose_311/index.html,£55.65,Five
"A History of God: The 4,000-Year Quest of Judaism, Christianity, and Islam",https://books.toscrape.com/catalogue/a-history-of-god-the-4000-year-quest-of-judaism-christianity-and-islam_310/index.html,£27.62,One
'Salem's Lot,https://books.toscrape.com/catalogue/salems-lot_309/index.html,£49.56,Four
Zero History (Blue Ant #3),https://books.toscrape.com/catalogue/zero-history-blue-ant-3_308/index.html,£34.77,One
Wuthering Heights,https://books.toscrape.com/catalogue/wuthering-heights_307/index.html,£17.73,Three
World War Z: An Oral History of the Zombie War,https://books.toscrape.com/catalogue/world-war-z-an-oral-history-of-the-zombie-war_306/index.html,£21.80,One
Wild: From Lost to Found on the Pacific Crest Trail,https://books.toscrape.com/catalogue/wild-from-lost-to-found-on-the-pacific-crest-trail_305/index.html,£46.02,Three
"Where'd You Go, Bernadette",https://books.toscrape.com/catalogue/whered-you-go-bernadette_304/index.html,£18.13,One
When You Are Engulfed in Flames,https://books.toscrape.com/catalogue/when-you-are-engulfed-in-flames_303/index.html,£30.89,Five
We the People: The Modern-Day Figures Who Have Reshaped and Affirmed the Founding Fathers' Vision of America,https://books.toscrape.com/catalogue/we-the-people-the-modern-day-figures-who-have-reshaped-and-affirmed-the-founding-fathers-vision-of-america_302/index.html,£31.95,Three
We Are All Completely Beside Ourselves,https://books.toscrape.com/catalogue/we-are-all-completely-beside-ourselves_301/index.html,£24.04,One
The Secret Healer,https://books.toscrape.com/catalogue/the-secret-healer_80/index.html,£34.56,Three
"The Sandman, Vol. 1: Preludes and Nocturnes (The Sandman (volumes) #1)",https://books.toscrape.com/catalogue/the-sandman-vol-1-preludes-and-nocturnes-the-sandman-volumes-1_79/index.html,£54.12,Three
The Republic,https://books.toscrape.com/catalogue/the-republic_78/index.html,£33.78,Three
The Odyssey,https://books.toscrape.com/catalogue/the-odyssey_77/index.html,£29.64,Three
The No. 1 Ladies' Detective Agency (No. 1 Ladies' Detective Agency #1),https://books.toscrape.com/catalogue/the-no-1-ladies-detective-agency-no-1-ladies-detective-agency-1_76/index.html,£57.70,Four
The Nicomachean Ethics,https://books.toscrape.com/catalogue/the-nicomachean-ethics_75/index.html,£36.34,One
The Name of the Wind (The Kingkiller Chronicle #1),https://books.toscrape.com/catalogue/the-name-of-the-wind-the-kingkiller-chronicle-1_74/index.html,£50.59,Three
The Mirror & the Maze (The Wrath and the Dawn #1.5),https://books.toscrape.com/catalogue/the-mirror-the-maze-the-wrath-and-the-dawn-15_73/index.html,£29.38,One
The Little Prince,https://books.toscrape.com/catalogue/the-little-prince_72/index.html,£45.42,Two
The Light of the Fireflies,https://books.toscrape.com/catalogue/the-light-of-the-fireflies_71/index.html,£54.43,One
The Last Girl (The Dominion Trilogy #1),https://books.toscrape.com/catalogue/the-last-girl-the-dominion-trilogy-1_70/index.html,£36.26,Two
The Iliad,https://books.toscrape.com/catalogue/the-iliad_69/index.html,£16.16,One
The Hook Up (Game On #1),https://books.toscrape.com/catalogue/the-hook-up-game-on-1_68/index.html,£36.29,Five
The Haters,https://books.toscrape.com/catalogue/the-haters_67/index.html,£27.89,Five
The Girl You Lost,https://books.toscrape.com/catalogue/the-girl-you-lost_66/index.html,£12.29,Five
The Girl In The Ice (DCI Erika Foster #1),https://books.toscrape.com/catalogue/the-girl-in-the-ice-dci-erika-foster-1_65/index.html,£15.85,Three
The End of the Jesus Era (An Investigation #1),https://books.toscrape.com/catalogue/the-end-of-the-jesus-era-an-investigation-1_64/index.html,£14.40,One
The Edge of Reason (Bridget Jones #2),https://books.toscrape.com/catalogue/the-edge-of-reason-bridget-jones-2_63/index.html,£19.18,Four
The Complete Maus (Maus #1-2),https://books.toscrape.com/catalogue/the-complete-maus-maus-1-2_62/index.html,£10.64,Three
The Communist Manifesto,https://books.toscrape.com/catalogue/the-communist-manifesto_61/index.html,£14.76,Three
The Da Vinci Code (Robert Langdon #2),https://books.toscrape.com/catalogue/the-da-vinci-code-robert-langdon-2_240/index.html,£22.96,Two
The Cuckoo's Calling (Cormoran Strike #1),https://books.toscrape.com/catalogue/the-cuckoos-calling-cormoran-strike-1_239/index.html,£19.21,One
The Complete Stories and Poems (The Works of Edgar Allan Poe [Cameo Edition]),https://books.toscrape.com/catalogue/the-complete-stories-and-poems-the-works-of-edgar-allan-poe-cameo-edition_238/index.html,£26.78,Four
The Complete Poems,https://books.toscrape.com/catalogue/the-complete-poems_237/index.html,£41.32,Five
The Catcher in the Rye,https://books.toscrape.com/catalogue/the-catcher-in-the-rye_236/index.html,£24.55,One
The Cat in the Hat (Beginner Books B-1),https://books.toscrape.com/catalogue/the-cat-in-the-hat-beginner-books-b-1_235/index.html,£16.26,Two
The Case for Christ (Cases for Christianity),https://books.toscrape.com/catalogue/the-case-for-christ-cases-for-christianity_234/index.html,£47.84,One
The Book Thief,https://books.toscrape.com/catalogue/the-book-thief_233/index.html,£53.49,Two
The Book of Basketball: The NBA According to The Sports Guy,https://books.toscrape.com/catalogue/the-book-of-basketball-the-nba-according-to-the-sports-guy_232/index.html,£44.84,Five
The Blind Side: Evolution of a Game,https://books.toscrape.com/catalogue/the-blind-side-evolution-of-a-game_231/index.html,£53.71,Five
The Autobiography of Malcolm X,https://books.toscrape.com/catalogue/the-autobiography-of-malcolm-x_230/index.html,£23.43,Two
"The Art of Simple Food: Notes, Lessons, and Recipes from a Delicious Revolution",https://books.toscrape.com/catalogue/the-art-of-simple-food-notes-lessons-and-recipes-from-a-delicious-revolution_229/index.html,£34.32,Three
The Art of Fielding,https://books.toscrape.com/catalogue/the-art-of-fielding_228/index.html,£22.10,One
"Surely You're Joking, Mr. Feynman!: Adventures of a Curious Character",https://books.toscrape.com/catalogue/surely-youre-joking-mr-feynman-adventures-of-a-curious-character_227/index.html,£25.83,Two
Stiff: The Curious Lives of Human Cadavers,https://books.toscrape.com/catalogue/stiff-the-curious-lives-of-human-cadavers_226/index.html,£36.74,Three
Spilled Milk: Based on a True Story,https://books.toscrape.com/catalogue/spilled-milk-based-on-a-true-story_225/index.html,£49.51,One
Something Borrowed (Darcy & Rachel #1),https://books.toscrape.com/catalogue/something-borrowed-darcy-rachel-1_224/index.html,£48.96,Five
Something Blue (Darcy & Rachel #2),https://books.toscrape.com/catalogue/something-blue-darcy-rachel-2_223/index.html,£54.62,One
Soldier (Talon #3),https://books.toscrape.com/catalogue/soldier-talon-3_222/index.html,£24.72,Two
Shopaholic & Baby (Shopaholic #5),https://books.toscrape.com/catalogue/shopaholic-baby-shopaholic-5_221/index.html,£46.45,Two
Chernobyl 01:23:40: The Incredible True Story of the World's Worst Nuclear Disaster,https://books.toscrape.com/catalogue/chernobyl-012340-the-incredible-true-story-of-the-worlds-worst-nuclear-disaster_560/index.html,£35.92,Two
Art and Fear: Observations on the Perils (and Rewards) of Artmaking,https://books.toscrape.com/catalogue/art-and-fear-observations-on-the-perils-and-rewards-of-artmaking_559/index.html,£48.63,Four
A Shard of Ice (The Black Symphony Saga #1),https://books.toscrape.com/catalogue/a-shard-of-ice-the-black-symphony-saga-1_558/index.html,£56.63,Three
