Title,URL,Product Price,Stars
A Hero's Curse (The Unseen Chronicles #1),https://books.toscrape.com/catalogue/a-heros-curse-the-unseen-chronicles-1_557/index.html,£50.49,Three
23 Degrees South: A Tropical Tale of Changing Whether...,https://books.toscrape.com/catalogue/23-degrees-south-a-tropical-tale-of-changing-whether_556/index.html,£35.79,Two
"Zero to One: Notes on Startups, or How to Build the Future",https://books.toscrape.com/catalogue/zero-to-one-notes-on-startups-or-how-to-build-the-future_555/index.html,£34.06,Three
Why Not Me?,https://books.toscrape.com/catalogue/why-not-me_554/index.html,£17.76,One
When Breath Becomes Air,https://books.toscrape.com/catalogue/when-breath-becomes-air_553/index.html,£39.36,Two
Vagabonding: An Uncommon Guide to the Art of Long-Term World Travel,https://books.toscrape.com/catalogue/vagabonding-an-uncommon-guide-to-the-art-of-long-term-world-travel_552/index.html,£36.94,Two
The Unlikely Pilgrimage of Harold Fry (Harold Fry #1),https://books.toscrape.com/catalogue/the-unlikely-pilgrimage-of-harold-fry-harold-fry-1_551/index.html,£43.62,Five
The New Drawing on the Right Side of the Brain,https://books.toscrape.com/catalogue/the-new-drawing-on-the-right-side-of-the-brain_550/index.html,£43.02,Three
"The Midnight Assassin: Panic, Scandal, and the Hunt for America's First Serial Killer",https://books.toscrape.com/catalogue/the-midnight-assassin-panic-scandal-and-the-hunt-for-americas-first-serial-killer_549/index.html,£28.45,Four
The Martian (The Martian #1),https://books.toscrape.com/catalogue/the-martian-the-martian-1_548/index.html,£41.39,Two
The High Mountains of Portugal,https://books.toscrape.com/catalogue/the-high-mountains-of-portugal_547/index.html,£51.15,One
The Grownup,https://books.toscrape.com/catalogue/the-grownup_546/index.html,£35.88,One
The E-Myth Revisited: Why Most Small Businesses Don't Work and What to Do About It,https://books.toscrape.com/catalogue/the-e-myth-revisited-why-most-small-businesses-dont-work-and-what-to-do-about-it_545/index.html,£36.91,One
South of Sunshine,https://books.toscrape.com/catalogue/south-of-sunshine_544/index.html,£28.93,One
Smarter Faster Better: The Secrets of Being Productive in Life and Business,https://books.toscrape.com/catalogue/smarter-faster-better-the-secrets-of-being-productive-in-life-and-business_543/index.html,£38.89,Five
Silence in the Dark (Logan Point #4),https://books.toscrape.com/catalogue/silence-in-the-dark-logan-point-4_542/index.html,£58.33,Three
Shadows of the Past (Logan Point #1),https://books.toscrape.com/catalogue/shadows-of-the-past-logan-point-1_541/index.html,£39.67,Five
World Without End (The Pillars of the Earth #2),https://books.toscrape.com/catalogue/world-without-end-the-pillars-of-the-earth-2_420/index.html,£32.97,Four
"Will Grayson, Will Grayson (Will Grayson, Will Grayson)",https://books.toscrape.com/catalogue/will-grayson-will-grayson-will-grayson-will-grayson_419/index.html,£47.31,Four
Why Save the Bankers?: And Other Essays on Our Economic and Political Crisis,https://books.toscrape.com/catalogue/why-save-the-bankers-and-other-essays-on-our-economic-and-political-crisis_418/index.html,£48.67,Two
Where She Went (If I Stay #2),https://books.toscrape.com/catalogue/where-she-went-if-i-stay-2_417/index.html,£41.73,Four
What If?: Serious Scientific Answers to Absurd Hypothetical Questions,https://books.toscrape.com/catalogue/what-if-serious-scientific-answers-to-absurd-hypothetical-questions_416/index.html,£53.68,Four
Two Summers,https://books.toscrape.com/catalogue/two-summers_415/index.html,£14.64,One
This Is Your Brain on Music: The Science of a Human Obsession,https://books.toscrape.com/catalogue/this-is-your-brain-on-music-the-science-of-a-human-obsession_414/index.html,£38.40,One
The Secret Garden,https://books.toscrape.com/catalogue/the-secret-garden_413/index.html,£15.08,Four
The Raven King (The Raven Cycle #4),https://books.toscrape.com/catalogue/the-raven-king-the-raven-cycle-4_412/index.html,£30.57,Two
The Raven Boys (The Raven Cycle #1),https://books.toscrape.com/catalogue/the-raven-boys-the-raven-cycle-1_411/index.html,£57.74,Four
The Power Greens Cookbook: 140 Delicious Superfood Recipes,https://books.toscrape.com/catalogue/the-power-greens-cookbook-140-delicious-superfood-recipes_410/index.html,£11.05,Five
The Metamorphosis,https://books.toscrape.com/catalogue/the-metamorphosis_409/index.html,£28.58,One
The Mathews Men: Seven Brothers and the War Against Hitler's U-boats,https://books.toscrape.com/catalogue/the-mathews-men-seven-brothers-and-the-war-against-hitlers-u-boats_408/index.html,£42.91,Five
The Little Paris Bookshop,https://books.toscrape.com/catalogue/the-little-paris-bookshop_407/index.html,£24.73,Three
The Hiding Place,https://books.toscrape.com/catalogue/the-hiding-place_406/index.html,£55.91,Four
The Grand Design,https://books.toscrape.com/catalogue/the-grand-design_405/index.html,£13.76,Three
The Firm,https://books.toscrape.com/catalogue/the-firm_404/index.html,£45.56,Three
The Fault in Our Stars,https://books.toscrape.com/catalogue/the-fault-in-our-stars_403/index.html,£47.22,One
The False Prince (The Ascendance Trilogy #1),https://books.toscrape.com/catalogue/the-false-prince-the-ascendance-trilogy-1_402/index.html,£56.00,Five
The Expatriates,https://books.toscrape.com/catalogue/the-expatriates_401/index.html,£44.58,Two
Walk the Edge (Thunder Road #2),https://books.toscrape.com/catalogue/walk-the-edge-thunder-road-2_300/index.html,£32.36,Three
Voyager (Outlander #3),https://books.toscrape.com/catalogue/voyager-outlander-3_299/index.html,£21.07,Five
Very Good Lives: The Fringe Benefits of Failure and the Importance of Imagination,https://books.toscrape.com/catalogue/very-good-lives-the-fringe-benefits-of-failure-and-the-importance-of-imagination_298/index.html,£50.66,Three
Vegan Vegetarian Omnivore: Dinner for Everyone at the Table,https://books.toscrape.com/catalogue/vegan-vegetarian-omnivore-dinner-for-everyone-at-the-table_297/index.html,£13.66,Two
"Unstuffed: Decluttering Your Home, Mind, and Soul",https://books.toscrape.com/catalogue/unstuffed-decluttering-your-home-mind-and-soul_296/index.html,£58.09,One
Under the Banner of Heaven: A Story of Violent Faith,https://books.toscrape.com/catalogue/under-the-banner-of-heaven-a-story-of-violent-faith_295/index.html,£30.00,One
Two Boys Kissing,https://books.toscrape.com/catalogue/two-boys-kissing_294/index.html,£32.74,Two
Twilight (Twilight #1),https://books.toscrape.com/catalogue/twilight-twilight-1_293/index.html,£41.93,Two
Twenties Girl,https://books.toscrape.com/catalogue/twenties-girl_292/index.html,£42.80,Two
"Trespassing Across America: One Man's Epic, Never-Done-Before (and Sort of Illegal) Hike Across the Heartland",https://books.toscrape.com/catalogue/trespassing-across-america-one-mans-epic-never-done-before-and-sort-of-illegal-hike-across-the-heartland_291/index.html,£53.51,One
Three-Martini Lunch,https://books.toscrape.com/catalogue/three-martini-lunch_290/index.html,£23.21,Three
"Thinking, Fast and Slow",https://books.toscrape.com/catalogue/thinking-fast-and-slow_289/index.html,£21.14,One
The Wild Robot,https://books.toscrape.com/catalogue/the-wild-robot_288/index.html,£56.07,Three
"The Wicked + The Divine, Vol. 3: Commercial Suicide (The Wicked + The Divine)",https://books.toscrape.com/catalogue/the-wicked-the-divine-vol-3-commercial-suicide-the-wicked-the-divine_287/index.html,£14.41,Three
The Undomestic Goddess,https://books.toscrape.com/catalogue/the-undomestic-goddess_286/index.html,£45.75,Four
The Travelers,https://books.toscrape.com/catalogue/the-travelers_285/index.html,£15.77,One
The Tipping Point: How Little Things Can Make a Big Difference,https://books.toscrape.com/catalogue/the-tipping-point-how-little-things-can-make-a-big-difference_284/index.html,£10.02,Two
The Thing About Jellyfish,https://books.toscrape.com/catalogue/the-thing-about-jellyfish_283/index.html,£48.77,One
The Stand,https://books.toscrape.com/catalogue/the-stand_282/index.html,£57.86,Two
The Smitten Kitchen Cookbook,https://books.toscrape.com/catalogue/the-smitten-kitchen-cookbook_281/index.html,£23.59,One
Frankenstein,https://books.toscrape.com/catalogue/frankenstein_20/index.html,£38.00,Two
Forever Rockers (The Rocker #12),https://books.toscrape.com/catalogue/forever-rockers-the-rocker-12_19/index.html,£28.80,Three
Fighting Fate (Fighting #6),https://books.toscrape.com/catalogue/fighting-fate-fighting-6_18/index.html,£39.24,Three
Emma,https://books.toscrape.com/catalogue/emma_17/index.html,£32.93,Two
"Eat, Pray, Love",https://books.toscrape.com/catalogue/eat-pray-love_16/index.html,£51.32,Three
Deep Under (Walker Security #1),https://books.toscrape.com/catalogue/deep-under-walker-security-1_15/index.html,£47.09,Five
Choosing Our Religion: The Spiritual Lives of America's Nones,https://books.toscrape.com/catalogue/choosing-our-religion-the-spiritual-lives-of-americas-nones_14/index.html,£28.42,Four
Charlie and the Chocolate Factory (Charlie Bucket #1),https://books.toscrape.com/catalogue/charlie-and-the-chocolate-factory-charlie-bucket-1_13/index.html,£22.85,Three
Charity's Cross (Charles Towne Belles #4),https://books.toscrape.com/catalogue/charitys-cross-charles-towne-belles-4_12/index.html,£41.24,One
Bright Lines,https://books.toscrape.com/catalogue/bright-lines_11/index.html,£39.07,Five
Bridget Jones's Diary (Bridget Jones #1),https://books.toscrape.com/catalogue/bridget-joness-diary-bridget-jones-1_10/index.html,£29.82,One
Bounty (Colorado Mountain #7),https://books.toscrape.com/catalogue/bounty-colorado-mountain-7_9/index.html,£37.26,Four
Blood Defense (Samantha Brinkman #1),https://books.toscrape.com/catalogue/blood-defense-samantha-brinkman-1_8/index.html,£20.30,Three
"Bleach, Vol. 1: Strawberry and the Soul Reapers (Bleach #1)",https://books.toscrape.com/catalogue/bleach-vol-1-strawberry-and-the-soul-reapers-bleach-1_7/index.html,£34.65,Five
Beyond Good and Evil,https://books.toscrape.com/catalogue/beyond-good-and-evil_6/index.html,£43.38,One
Alice in Wonderland (Alice's Adventures in Wonderland #1),https://books.toscrape.com/catalogue/alice-in-wonderland-alices-adventures-in-wonderland-1_5/index.html,£55.53,One
"Ajin: Demi-Human, Volume 1 (Ajin: Demi-Human #1)",https://books.toscrape.com/catalogue/ajin-demi-human-volume-1-ajin-demi-human-1_4/index.html,£57.06,Four
A Spy's Devotion (The Regency Spies of London #1),https://books.toscrape.com/catalogue/a-spys-devotion-the-regency-spies-of-london-1_3/index.html,£16.97,Five
1st to Die (Women's Murder Club #1),https://books.toscrape.com/catalogue/1st-to-die-womens-murder-club-1_2/index.html,£53.98,One
"1,000 Places to See Before You Die",https://books.toscrape.com/catalogue/1000-places-to-see-before-you-die_1/index.html,£26.08,Five
The Nameless City (The Nameless City #1),https://books.toscrape.com/catalogue/the-nameless-city-the-nameless-city-1_940/index.html,£38.16,Four
The Murder That Never Was (Forensic Instincts #5),https://books.toscrape.com/catalogue/the-murder-that-never-was-forensic-instincts-5_939/index.html,£54.11,Three
The Most Perfect Thing: Inside (and Outside) a Bird's Egg,https://books.toscrape.com/catalogue/the-most-perfect-thing-inside-and-outside-a-birds-egg_938/index.html,£42.96,Four
"The Mindfulness and Acceptance Workbook for Anxiety: A Guide to Breaking Free from Anxiety, Phobias, and Worry Using Acceptance and Commitment Therapy",https://books.toscrape.com/catalogue/the-mindfulness-and-acceptance-workbook-for-anxiety-a-guide-to-breaking-free-from-anxiety-phobias-and-worry-using-acceptance-and-commitment-therapy_937/index.html,£23.89,Four
The Life-Changing Magic of Tidying Up: The Japanese Art of Decluttering and Organizing,https://books.toscrape.com/catalogue/the-life-changing-magic-of-tidying-up-the-japanese-art-of-decluttering-and-organizing_936/index.html,£16.77,Three
"The Inefficiency Assassin: Time Management Tactics for Working Smarter, Not Longer",https://books.toscrape.com/catalogue/the-inefficiency-assassin-time-management-tactics-for-working-smarter-not-longer_935/index.html,£20.59,Five
The Gutsy Girl: Escapades for Your Life of Epic Adventure,https://books.toscrape.com/catalogue/the-gutsy-girl-escapades-for-your-life-of-epic-adventure_934/index.html,£37.13,One
The Electric Pencil: Drawings from Inside State Hospital No. 3,https://books.toscrape.com/catalogue/the-electric-pencil-drawings-from-inside-state-hospital-no-3_933/index.html,£56.06,One
The Death of Humanity: and the Case for Life,https://books.toscrape.com/catalogue/the-death-of-humanity-and-the-case-for-life_932/index.html,£58.11,Four
"The Bulletproof Diet: Lose up to a Pound a Day, Reclaim Energy and Focus, Upgrade Your Life",https://books.toscrape.com/catalogue/the-bulletproof-diet-lose-up-to-a-pound-a-day-reclaim-energy-and-focus-upgrade-your-life_931/index.html,£49.05,Three
The Art Forger,https://books.toscrape.com/catalogue/the-art-forger_930/index.html,£40.76,Three
The Age of Genius: The Seventeenth Century and the Birth of the Modern Mind,https://books.toscrape.com/catalogue/the-age-of-genius-the-seventeenth-century-and-the-birth-of-the-modern-mind_929/index.html,£19.73,One
The Activist's Tao Te Ching: Ancient Advice for a Modern Revolution,https://books.toscrape.com/catalogue/the-activists-tao-te-ching-ancient-advice-for-a-modern-revolution_928/index.html,£32.24,Five
Spark Joy: An Illustrated Master Class on the Art of Organizing and Tidying Up,https://books.toscrape.com/catalogue/spark-joy-an-illustrated-master-class-on-the-art-of-organizing-and-tidying-up_927/index.html,£41.83,Four
Soul Reader,https://books.toscrape.com/catalogue/soul-reader_926/index.html,£39.58,Two
Security,https://books.toscrape.com/catalogue/security_925/index.html,£39.25,Two
"Saga, Volume 6 (Saga (Collected Editions) #6)",https://books.toscrape.com/catalogue/saga-volume-6-saga-collected-editions-6_924/index.html,£25.02,Three
"Saga, Volume 5 (Saga (Collected Editions) #5)",https://books.toscrape.com/catalogue/saga-volume-5-saga-collected-editions-5_923/index.html,£51.04,Two
Reskilling America: Learning to Labor in the Twenty-First Century,https://books.toscrape.com/catalogue/reskilling-america-learning-to-labor-in-the-twenty-first-century_922/index.html,£19.83,Two
"Rat Queens, Vol. 3: Demons (Rat Queens (Collected Editions) #11-15)",https://books.toscrape.com/catalogue/rat-queens-vol-3-demons-rat-queens-collected-editions-11-15_921/index.html,£50.40,Three
The Lean Startup: How Today's Entrepreneurs Use Continuous Innovation to Create Radically Successful Businesses,https://books.toscrape.com/catalogue/the-lean-startup-how-todays-entrepreneurs-use-continuous-innovation-to-create-radically-successful-businesses_260/index.html,£33.92,Three
The Last Painting of Sara de Vos,https://books.toscrape.com/catalogue/the-last-painting-of-sara-de-vos_259/index.html,£55.55,Two
"The Land of 10,000 Madonnas",https://books.toscrape.com/catalogue/the-land-of-10000-madonnas_258/index.html,£29.64,Four
The Infinities,https://books.toscrape.com/catalogue/the-infinities_257/index.html,£27.41,One
The Husband's Secret,https://books.toscrape.com/catalogue/the-husbands-secret_256/index.html,£52.51,Five
The Hitchhiker's Guide to the Galaxy (Hitchhiker's Guide to the Galaxy #1),https://books.toscrape.com/catalogue/the-hitchhikers-guide-to-the-galaxy-hitchhikers-guide-to-the-galaxy-1_255/index.html,£47.80,Three
The Guns of August,https://books.toscrape.com/catalogue/the-guns-of-august_254/index.html,£14.54,Two
The Guernsey Literary and Potato Peel Pie Society,https://books.toscrape.com/catalogue/the-guernsey-literary-and-potato-peel-pie-society_253/index.html,£49.53,One
The Goldfinch,https://books.toscrape.com/catalogue/the-goldfinch_252/index.html,£43.58,Three
The Giver (The Giver Quartet #1),https://books.toscrape.com/catalogue/the-giver-the-giver-quartet-1_251/index.html,£12.30,One
The Girl with All the Gifts,https://books.toscrape.com/catalogue/the-girl-with-all-the-gifts_250/index.html,£49.47,Three
The Girl Who Played with Fire (Millennium Trilogy #2),https://books.toscrape.com/catalogue/the-girl-who-played-with-fire-millennium-trilogy-2_249/index.html,£22.14,Two
The Girl Who Kicked the Hornet's Nest (Millennium Trilogy #3),https://books.toscrape.com/catalogue/the-girl-who-kicked-the-hornets-nest-millennium-trilogy-3_248/index.html,£57.48,One
The Exiled,https://books.toscrape.com/catalogue/the-exiled_247/index.html,£43.45,Three
"The End of Faith: Religion, Terror, and the Future of Reason",https://books.toscrape.com/catalogue/the-end-of-faith-religion-terror-and-the-future-of-reason_246/index.html,£22.13,Four
"The Elegant Universe: Superstrings, Hidden Dimensions, and the Quest for the Ultimate Theory",https://books.toscrape.com/catalogue/the-elegant-universe-superstrings-hidden-dimensions-and-the-quest-for-the-ultimate-theory_245/index.html,£13.03,Four
"The Disappearing Spoon: And Other True Tales of Madness, Love, and the History of the World from the Periodic Table of the Elements",https://books.toscrape.com/catalogue/the-disappearing-spoon-and-other-true-tales-of-madness-love-and-the-history-of-the-world-from-the-periodic-table-of-the-elements_244/index.html,£57.35,Five
The Devil Wears Prada (The Devil Wears Prada #1),https://books.toscrape.com/catalogue/the-devil-wears-prada-the-devil-wears-prada-1_243/index.html,£44.29,One
The Demon-Haunted World: Science as a Candle in the Dark,https://books.toscrape.com/catalogue/the-demon-haunted-world-science-as-a-candle-in-the-dark_242/index.html,£52.25,Four
The Day the Crayons Came Home (Crayons),https://books.toscrape.com/catalogue/the-day-the-crayons-came-home-crayons_241/index.html,£26.33,Five
The Power of Habit: Why We Do What We Do in Life and Business,https://books.toscrape.com/catalogue/the-power-of-habit-why-we-do-what-we-do-in-life-and-business_760/index.html,£16.88,Three
The Marriage of Opposites,https://books.toscrape.com/catalogue/the-marriage-of-opposites_759/index.html,£28.08,Four
The Lucifer Effect: Understanding How Good People Turn Evil,https://books.toscrape.com/catalogue/the-lucifer-effect-understanding-how-good-people-turn-evil_758/index.html,£10.40,One
The Long Haul (Diary of a Wimpy Kid #9),https://books.toscrape.com/catalogue/the-long-haul-diary-of-a-wimpy-kid-9_757/index.html,£44.07,One
The Loney,https://books.toscrape.com/catalogue/the-loney_756/index.html,£23.40,One
The Literature Book (Big Ideas Simply Explained),https://books.toscrape.com/catalogue/the-literature-book-big-ideas-simply-explained_755/index.html,£17.43,Three
The Last Mile (Amos Decker #2),https://books.toscrape.com/catalogue/the-last-mile-amos-decker-2_754/index.html,£54.21,Two
The Immortal Life of Henrietta Lacks,https://books.toscrape.com/catalogue/the-immortal-life-of-henrietta-lacks_753/index.html,£40.67,Two
The Hidden Oracle (The Trials of Apollo #1),https://books.toscrape.com/catalogue/the-hidden-oracle-the-trials-of-apollo-1_752/index.html,£52.26,Two
The Help Yourself Cookbook for Kids: 60 Easy Plant-Based Recipes Kids Can Make to Stay Healthy and Save the Earth,https://books.toscrape.com/catalogue/the-help-yourself-cookbook-for-kids-60-easy-plant-based-recipes-kids-can-make-to-stay-healthy-and-save-the-earth_751/index.html,£28.77,Three
The Guilty (Will Robie #4),https://books.toscrape.com/catalogue/the-guilty-will-robie-4_750/index.html,£13.82,Two
The First Hostage (J.B. Collins #2),https://books.toscrape.com/catalogue/the-first-hostage-jb-collins-2_749/index.html,£25.85,Three
The Dovekeepers,https://books.toscrape.com/catalogue/the-dovekeepers_748/index.html,£48.78,One
The Darkest Lie,https://books.toscrape.com/catalogue/the-darkest-lie_747/index.html,£35.35,Five
The Bane Chronicles (The Bane Chronicles #1-11),https://books.toscrape.com/catalogue/the-bane-chronicles-the-bane-chronicles-1-11_746/index.html,£44.73,Four
The Bad-Ass Librarians of Timbuktu: And Their Race to Save the World’s Most Precious Manuscripts,https://books.toscrape.com/catalogue/the-bad-ass-librarians-of-timbuktu-and-their-race-to-save-the-worlds-most-precious-manuscripts_745/index.html,£15.77,One
The 14th Colony (Cotton Malone #11),https://books.toscrape.com/catalogue/the-14th-colony-cotton-malone-11_744/index.html,£39.24,One
That Darkness (Gardiner and Renner #1),https://books.toscrape.com/catalogue/that-darkness-gardiner-and-renner-1_743/index.html,£13.92,One
Tastes Like Fear (DI Marnie Rome #3),https://books.toscrape.com/catalogue/tastes-like-fear-di-marnie-rome-3_742/index.html,£10.69,One
Take Me with You,https://books.toscrape.com/catalogue/take-me-with-you_741/index.html,£45.21,Three
Without Shame,https://books.toscrape.com/catalogue/without-shame_580/index.html,£48.27,Five
Watchmen,https://books.toscrape.com/catalogue/watchmen_579/index.html,£58.05,Four
Unlimited Intuition Now,https://books.toscrape.com/catalogue/unlimited-intuition-now_578/index.html,£58.87,Four
Underlying Notes,https://books.toscrape.com/catalogue/underlying-notes_577/index.html,£11.82,Two
The Shack,https://books.toscrape.com/catalogue/the-shack_576/index.html,£28.03,One
The New Brand You: Your New Image Makes the Sale for You,https://books.toscrape.com/catalogue/the-new-brand-you-your-new-image-makes-the-sale-for-you_575/index.html,£44.05,Five
"The Moosewood Cookbook: Recipes from Moosewood Restaurant, Ithaca, New York",https://books.toscrape.com/catalogue/the-moosewood-cookbook-recipes-from-moosewood-restaurant-ithaca-new-york_574/index.html,£12.34,Four
The Flowers Lied,https://books.toscrape.com/catalogue/the-flowers-lied_573/index.html,£16.68,Two
"The Fabric of the Cosmos: Space, Time, and the Texture of Reality",https://books.toscrape.com/catalogue/the-fabric-of-the-cosmos-space-time-and-the-texture-of-reality_572/index.html,£55.91,One
The Book of Mormon,https://books.toscrape.com/catalogue/the-book-of-mormon_571/index.html,£24.57,Three
The Art and Science of Low Carbohydrate Living,https://books.toscrape.com/catalogue/the-art-and-science-of-low-carbohydrate-living_570/index.html,£52.98,Five
The Alien Club,https://books.toscrape.com/catalogue/the-alien-club_569/index.html,£54.40,One
Suzie Snowflake: One beautiful flake (a self-esteem story),https://books.toscrape.com/catalogue/suzie-snowflake-one-beautiful-flake-a-self-esteem-story_568/index.html,£54.81,Five
Nap-a-Roo,https://books.toscrape.com/catalogue/nap-a-roo_567/index.html,£25.08,One
"NaNo What Now? Finding your editing process, revising your NaNoWriMo book and building a writing career through publishing and beyond",https://books.toscrape.com/catalogue/nano-what-now-finding-your-editing-process-revising-your-nanowrimo-book-and-building-a-writing-career-through-publishing-and-beyond_566/index.html,£10.41,Four
Modern Day Fables,https://books.toscrape.com/catalogue/modern-day-fables_565/index.html,£47.44,Two
If I Gave You God's Phone Number....: Searching for Spirituality in America,https://books.toscrape.com/catalogue/if-i-gave-you-gods-phone-number-searching-for-spirituality-in-america_564/index.html,£20.91,One
"Fruits Basket, Vol. 9 (Fruits Basket #9)",https://books.toscrape.com/catalogue/fruits-basket-vol-9-fruits-basket-9_563/index.html,£33.95,Four
Dress Your Family in Corduroy and Denim,https://books.toscrape.com/catalogue/dress-your-family-in-corduroy-and-denim_562/index.html,£43.68,Three
Don't Forget Steven,https://books.toscrape.com/catalogue/dont-forget-steven_561/index.html,£33.23,One
The Barefoot Contessa Cookbook,https://books.toscrape.com/catalogue/the-barefoot-contessa-cookbook_440/index.html,£59.92,Five
Tell the Wolves I'm Home,https://books.toscrape.com/catalogue/tell-the-wolves-im-home_439/index.html,£50.96,Two
Ship Leaves Harbor: Essays on Travel by a Recovering Journeyman,https://books.toscrape.com/catalogue/ship-leaves-harbor-essays-on-travel-by-a-recovering-journeyman_438/index.html,£30.60,Three
Pride and Prejudice,https://books.toscrape.com/catalogue/pride-and-prejudice_437/index.html,£19.27,Four
Musicophilia: Tales of Music and the Brain,https://books.toscrape.com/catalogue/musicophilia-tales-of-music-and-the-brain_436/index.html,£46.58,One
Mere Christianity,https://books.toscrape.com/catalogue/mere-christianity_435/index.html,£48.51,Three
Me Before You (Me Before You #1),https://books.toscrape.com/catalogue/me-before-you-me-before-you-1_434/index.html,£19.02,One
In the Woods (Dublin Murder Squad #1),https://books.toscrape.com/catalogue/in-the-woods-dublin-murder-squad-1_433/index.html,£38.38,Two
In Cold Blood,https://books.toscrape.com/catalogue/in-cold-blood_432/index.html,£49.98,Four
How to Stop Worrying and Start Living,https://books.toscrape.com/catalogue/how-to-stop-worrying-and-start-living_431/index.html,£46.49,Five
Give It Back,https://books.toscrape.com/catalogue/give-it-back_430/index.html,£18.32,Two
"Girl, Interrupted",https://books.toscrape.com/catalogue/girl-interrupted_429/index.html,£42.14,Three
Fun Home: A Family Tragicomic,https://books.toscrape.com/catalogue/fun-home-a-family-tragicomic_428/index.html,£56.59,Four
"Fruits Basket, Vol. 6 (Fruits Basket #6)",https://books.toscrape.com/catalogue/fruits-basket-vol-6-fruits-basket-6_427/index.html,£20.96,Four
Deception Point,https://books.toscrape.com/catalogue/deception-point_426/index.html,£40.32,Four
"Death Note, Vol. 6: Give-and-Take (Death Note #6)",https://books.toscrape.com/catalogue/death-note-vol-6-give-and-take-death-note-6_425/index.html,£36.39,Three
Catherine the Great: Portrait of a Woman,https://books.toscrape.com/catalogue/catherine-the-great-portrait-of-a-woman_424/index.html,£58.55,Four
