Title,URL,Product Price,Stars
No Dream Is Too High: Life Lessons From a Man Who Walked on the Moon,https://books.toscrape.com/catalogue/no-dream-is-too-high-life-lessons-from-a-man-who-walked-on-the-moon_722/index.html,£21.95,Two
"Naruto (3-in-1 Edition), Vol. 14: Includes Vols. 40, 41 & 42 (Naruto: Omnibus #14)",https://books.toscrape.com/catalogue/naruto-3-in-1-edition-vol-14-includes-vols-40-41-42-naruto-omnibus-14_721/index.html,£38.39,Two
Jurassic Park (Jurassic Park #1),https://books.toscrape.com/catalogue/jurassic-park-jurassic-park-1_180/index.html,£44.97,One
It's Never Too Late to Begin Again: Discovering Creativity and Meaning at Midlife and Beyond,https://books.toscrape.com/catalogue/its-never-too-late-to-begin-again-discovering-creativity-and-meaning-at-midlife-and-beyond_179/index.html,£42.38,One
Is Everyone Hanging Out Without Me? (And Other Concerns),https://books.toscrape.com/catalogue/is-everyone-hanging-out-without-me-and-other-concerns_178/index.html,£20.11,Three
Into the Wild,https://books.toscrape.com/catalogue/into-the-wild_177/index.html,£56.70,Five
Inferno (Robert Langdon #4),https://books.toscrape.com/catalogue/inferno-robert-langdon-4_176/index.html,£41.00,Five
"In the Garden of Beasts: Love, Terror, and an American Family in Hitler's Berlin",https://books.toscrape.com/catalogue/in-the-garden-of-beasts-love-terror-and-an-american-family-in-hitlers-berlin_175/index.html,£28.85,Three
If I Run (If I Run #1),https://books.toscrape.com/catalogue/if-i-run-if-i-run-1_174/index.html,£49.97,Four
I've Got Your Number,https://books.toscrape.com/catalogue/ive-got-your-number_173/index.html,£19.69,One
I Am Malala: The Girl Who Stood Up for Education and Was Shot by the Taliban,https://books.toscrape.com/catalogue/i-am-malala-the-girl-who-stood-up-for-education-and-was-shot-by-the-taliban_172/index.html,£28.88,Two
Hungry Girl Clean & Hungry: Easy All-Natural Recipes for Healthy Eating in the Real World,https://books.toscrape.com/catalogue/hungry-girl-clean-hungry-easy-all-natural-recipes-for-healthy-eating-in-the-real-world_171/index.html,£33.14,Three
"House of Lost Worlds: Dinosaurs, Dynasties, and the Story of Life on Earth",https://books.toscrape.com/catalogue/house-of-lost-worlds-dinosaurs-dynasties-and-the-story-of-life-on-earth_170/index.html,£43.70,Two
House of Leaves,https://books.toscrape.com/catalogue/house-of-leaves_169/index.html,£54.89,One
Horrible Bear!,https://books.toscrape.com/catalogue/horrible-bear_168/index.html,£37.52,Two
Holidays on Ice,https://books.toscrape.com/catalogue/holidays-on-ice_167/index.html,£51.07,Two
Heir to the Sky,https://books.toscrape.com/catalogue/heir-to-the-sky_166/index.html,£44.07,Four
Green Eggs and Ham (Beginner Books B-16),https://books.toscrape.com/catalogue/green-eggs-and-ham-beginner-books-b-16_165/index.html,£10.79,Four
"Grayson, Vol 3: Nemesis (Grayson #3)",https://books.toscrape.com/catalogue/grayson-vol-3-nemesis-grayson-3_164/index.html,£42.72,One
Gratitude,https://books.toscrape.com/catalogue/gratitude_163/index.html,£26.66,Five
Gone Girl,https://books.toscrape.com/catalogue/gone-girl_162/index.html,£37.60,Five
Golden (Heart of Dread #3),https://books.toscrape.com/catalogue/golden-heart-of-dread-3_161/index.html,£42.21,Four
"Fruits Basket, Vol. 2 (Fruits Basket #2)",https://books.toscrape.com/catalogue/fruits-basket-vol-2-fruits-basket-2_100/index.html,£11.64,Five
Diary of a Minecraft Zombie Book 1: A Scare of a Dare (An Unofficial Minecraft Book),https://books.toscrape.com/catalogue/diary-of-a-minecraft-zombie-book-1-a-scare-of-a-dare-an-unofficial-minecraft-book_99/index.html,£52.88,Four
"Y: The Last Man, Vol. 1: Unmanned (Y: The Last Man #1)",https://books.toscrape.com/catalogue/y-the-last-man-vol-1-unmanned-y-the-last-man-1_98/index.html,£18.51,Four
While You Were Mine,https://books.toscrape.com/catalogue/while-you-were-mine_97/index.html,£41.32,Five
Where Lightning Strikes (Bleeding Stars #3),https://books.toscrape.com/catalogue/where-lightning-strikes-bleeding-stars-3_96/index.html,£39.77,Three
When I'm Gone,https://books.toscrape.com/catalogue/when-im-gone_95/index.html,£51.96,Three
Ways of Seeing,https://books.toscrape.com/catalogue/ways-of-seeing_94/index.html,£39.51,Five
"Vampire Knight, Vol. 1 (Vampire Knight #1)",https://books.toscrape.com/catalogue/vampire-knight-vol-1-vampire-knight-1_93/index.html,£15.40,One
Vampire Girl (Vampire Girl #1),https://books.toscrape.com/catalogue/vampire-girl-vampire-girl-1_92/index.html,£53.82,Two
Twenty Love Poems and a Song of Despair,https://books.toscrape.com/catalogue/twenty-love-poems-and-a-song-of-despair_91/index.html,£30.95,Four
Travels with Charley: In Search of America,https://books.toscrape.com/catalogue/travels-with-charley-in-search-of-america_90/index.html,£57.82,Five
Three Wishes (River of Time: California #1),https://books.toscrape.com/catalogue/three-wishes-river-of-time-california-1_89/index.html,£44.18,Two
This One Moment (Pushing Limits #1),https://books.toscrape.com/catalogue/this-one-moment-pushing-limits-1_88/index.html,£48.71,One
The Zombie Room,https://books.toscrape.com/catalogue/the-zombie-room_87/index.html,£19.69,Five
"The Wicked + The Divine, Vol. 1: The Faust Act (The Wicked + The Divine)",https://books.toscrape.com/catalogue/the-wicked-the-divine-vol-1-the-faust-act-the-wicked-the-divine_86/index.html,£36.52,Two
The Tumor,https://books.toscrape.com/catalogue/the-tumor_85/index.html,£41.56,Five
The Story of Hong Gildong,https://books.toscrape.com/catalogue/the-story-of-hong-gildong_84/index.html,£43.19,Four
The Silent Wife,https://books.toscrape.com/catalogue/the-silent-wife_83/index.html,£12.34,Five
The Silent Twin (Detective Jennifer Knight #3),https://books.toscrape.com/catalogue/the-silent-twin-detective-jennifer-knight-3_82/index.html,£36.25,Three
The Selfish Gene,https://books.toscrape.com/catalogue/the-selfish-gene_81/index.html,£29.45,One
Nightstruck: A Novel,https://books.toscrape.com/catalogue/nightstruck-a-novel_480/index.html,£50.35,Four
"Naturally Lean: 125 Nourishing Gluten-Free, Plant-Based Recipes--All Under 300 Calories",https://books.toscrape.com/catalogue/naturally-lean-125-nourishing-gluten-free-plant-based-recipes-all-under-300-calories_479/index.html,£11.38,Five
Meternity,https://books.toscrape.com/catalogue/meternity_478/index.html,£43.58,Three
Memoirs of a Geisha,https://books.toscrape.com/catalogue/memoirs-of-a-geisha_477/index.html,£49.67,Three
Like Never Before (Walker Family #2),https://books.toscrape.com/catalogue/like-never-before-walker-family-2_476/index.html,£28.77,Two
Life of Pi,https://books.toscrape.com/catalogue/life-of-pi_475/index.html,£13.22,Four
Leave This Song Behind: Teen Poetry at Its Best,https://books.toscrape.com/catalogue/leave-this-song-behind-teen-poetry-at-its-best_474/index.html,£51.17,Five
King's Folly (The Kinsman Chronicles #1),https://books.toscrape.com/catalogue/kings-folly-the-kinsman-chronicles-1_473/index.html,£39.61,Five
John Adams,https://books.toscrape.com/catalogue/john-adams_472/index.html,£57.43,Four
How to Cook Everything Vegetarian: Simple Meatless Recipes for Great Food (How to Cook Everything),https://books.toscrape.com/catalogue/how-to-cook-everything-vegetarian-simple-meatless-recipes-for-great-food-how-to-cook-everything_471/index.html,£46.01,Four
How to Be a Domestic Goddess: Baking and the Art of Comfort Cooking,https://books.toscrape.com/catalogue/how-to-be-a-domestic-goddess-baking-and-the-art-of-comfort-cooking_470/index.html,£28.25,Two
Good in Bed (Cannie Shapiro #1),https://books.toscrape.com/catalogue/good-in-bed-cannie-shapiro-1_469/index.html,£37.05,Five
"Fruits Basket, Vol. 7 (Fruits Basket #7)",https://books.toscrape.com/catalogue/fruits-basket-vol-7-fruits-basket-7_468/index.html,£19.57,One
For the Love: Fighting for Grace in a World of Impossible Standards,https://books.toscrape.com/catalogue/for-the-love-fighting-for-grace-in-a-world-of-impossible-standards_467/index.html,£45.13,Three
Finding God in the Ruins: How God Redeems Pain,https://books.toscrape.com/catalogue/finding-god-in-the-ruins-how-god-redeems-pain_466/index.html,£46.64,Two
Every Heart a Doorway (Every Heart A Doorway #1),https://books.toscrape.com/catalogue/every-heart-a-doorway-every-heart-a-doorway-1_465/index.html,£12.16,Five
Delivering the Truth (Quaker Midwife Mystery #1),https://books.toscrape.com/catalogue/delivering-the-truth-quaker-midwife-mystery-1_464/index.html,£20.89,Four
Counted With the Stars (Out from Egypt #1),https://books.toscrape.com/catalogue/counted-with-the-stars-out-from-egypt-1_463/index.html,£17.97,Five
"Chronicles, Vol. 1",https://books.toscrape.com/catalogue/chronicles-vol-1_462/index.html,£52.60,Two
Blue Like Jazz: Nonreligious Thoughts on Christian Spirituality,https://books.toscrape.com/catalogue/blue-like-jazz-nonreligious-thoughts-on-christian-spirituality_461/index.html,£25.77,One
"Princess Jellyfish 2-in-1 Omnibus, Vol. 01 (Princess Jellyfish 2-in-1 Omnibus #1)",https://books.toscrape.com/catalogue/princess-jellyfish-2-in-1-omnibus-vol-01-princess-jellyfish-2-in-1-omnibus-1_920/index.html,£13.61,Five
Princess Between Worlds (Wide-Awake Princess #5),https://books.toscrape.com/catalogue/princess-between-worlds-wide-awake-princess-5_919/index.html,£13.34,Five
"Pop Gun War, Volume 1: Gift",https://books.toscrape.com/catalogue/pop-gun-war-volume-1-gift_918/index.html,£18.97,One
"Political Suicide: Missteps, Peccadilloes, Bad Calls, Backroom Hijinx, Sordid Pasts, Rotten Breaks, and Just Plain Dumb Mistakes in the Annals of American Politics",https://books.toscrape.com/catalogue/political-suicide-missteps-peccadilloes-bad-calls-backroom-hijinx-sordid-pasts-rotten-breaks-and-just-plain-dumb-mistakes-in-the-annals-of-american-politics_917/index.html,£36.28,Two
Patience,https://books.toscrape.com/catalogue/patience_916/index.html,£10.16,Three
"Outcast, Vol. 1: A Darkness Surrounds Him (Outcast #1)",https://books.toscrape.com/catalogue/outcast-vol-1-a-darkness-surrounds-him-outcast-1_915/index.html,£15.44,Four
orange: The Complete Collection 1 (orange: The Complete Collection #1),https://books.toscrape.com/catalogue/orange-the-complete-collection-1-orange-the-complete-collection-1_914/index.html,£48.41,One
Online Marketing for Busy Authors: A Step-By-Step Guide,https://books.toscrape.com/catalogue/online-marketing-for-busy-authors-a-step-by-step-guide_913/index.html,£46.35,One
On a Midnight Clear,https://books.toscrape.com/catalogue/on-a-midnight-clear_912/index.html,£14.07,Three
Obsidian (Lux #1),https://books.toscrape.com/catalogue/obsidian-lux-1_911/index.html,£14.86,Two
My Paris Kitchen: Recipes and Stories,https://books.toscrape.com/catalogue/my-paris-kitchen-recipes-and-stories_910/index.html,£33.37,Two
Masks and Shadows,https://books.toscrape.com/catalogue/masks-and-shadows_909/index.html,£56.40,Two
"Mama Tried: Traditional Italian Cooking for the Screwed, Crude, Vegan, and Tattooed",https://books.toscrape.com/catalogue/mama-tried-traditional-italian-cooking-for-the-screwed-crude-vegan-and-tattooed_908/index.html,£14.02,Four
"Lumberjanes, Vol. 2: Friendship to the Max (Lumberjanes #5-8)",https://books.toscrape.com/catalogue/lumberjanes-vol-2-friendship-to-the-max-lumberjanes-5-8_907/index.html,£46.91,Two
"Lumberjanes, Vol. 1: Beware the Kitten Holy (Lumberjanes #1-4)",https://books.toscrape.com/catalogue/lumberjanes-vol-1-beware-the-kitten-holy-lumberjanes-1-4_906/index.html,£45.61,Three
Lumberjanes Vol. 3: A Terrible Plan (Lumberjanes #9-12),https://books.toscrape.com/catalogue/lumberjanes-vol-3-a-terrible-plan-lumberjanes-9-12_905/index.html,£19.92,Two
"Layered: Baking, Building, and Styling Spectacular Cakes",https://books.toscrape.com/catalogue/layered-baking-building-and-styling-spectacular-cakes_904/index.html,£40.11,One
Judo: Seven Steps to Black Belt (an Introductory Guide for Beginners),https://books.toscrape.com/catalogue/judo-seven-steps-to-black-belt-an-introductory-guide-for-beginners_903/index.html,£53.90,Two
Join,https://books.toscrape.com/catalogue/join_902/index.html,£35.67,Five
In the Country We Love: My Family Divided,https://books.toscrape.com/catalogue/in-the-country-we-love-my-family-divided_901/index.html,£22.00,Four
The Midnight Watch: A Novel of the Titanic and the Californian,https://books.toscrape.com/catalogue/the-midnight-watch-a-novel-of-the-titanic-and-the-californian_640/index.html,£26.20,One
The Lonely City: Adventures in the Art of Being Alone,https://books.toscrape.com/catalogue/the-lonely-city-adventures-in-the-art-of-being-alone_639/index.html,£33.26,Two
The Gray Rhino: How to Recognize and Act on the Obvious Dangers We Ignore,https://books.toscrape.com/catalogue/the-gray-rhino-how-to-recognize-and-act-on-the-obvious-dangers-we-ignore_638/index.html,£59.15,Four
The Golden Condom: And Other Essays on Love Lost and Found,https://books.toscrape.com/catalogue/the-golden-condom-and-other-essays-on-love-lost-and-found_637/index.html,£39.43,One
The Epidemic (The Program 0.6),https://books.toscrape.com/catalogue/the-epidemic-the-program-06_636/index.html,£14.44,Five
The Dinner Party,https://books.toscrape.com/catalogue/the-dinner-party_635/index.html,£56.54,Two
The Diary of a Young Girl,https://books.toscrape.com/catalogue/the-diary-of-a-young-girl_634/index.html,£59.90,Three
The Children,https://books.toscrape.com/catalogue/the-children_633/index.html,£11.88,Three
Stars Above (The Lunar Chronicles #4.5),https://books.toscrape.com/catalogue/stars-above-the-lunar-chronicles-45_632/index.html,£48.05,Two
Snatched: How A Drug Queen Went Undercover for the DEA and Was Kidnapped By Colombian Guerillas,https://books.toscrape.com/catalogue/snatched-how-a-drug-queen-went-undercover-for-the-dea-and-was-kidnapped-by-colombian-guerillas_631/index.html,£21.21,Three
Raspberry Pi Electronics Projects for the Evil Genius,https://books.toscrape.com/catalogue/raspberry-pi-electronics-projects-for-the-evil-genius_630/index.html,£49.67,Four
Quench Your Own Thirst: Business Lessons Learned Over a Beer or Two,https://books.toscrape.com/catalogue/quench-your-own-thirst-business-lessons-learned-over-a-beer-or-two_629/index.html,£43.14,One
Psycho: Sanitarium (Psycho #1.5),https://books.toscrape.com/catalogue/psycho-sanitarium-psycho-15_628/index.html,£36.97,Five
Poisonous (Max Revere Novels #3),https://books.toscrape.com/catalogue/poisonous-max-revere-novels-3_627/index.html,£26.80,Three
One with You (Crossfire #5),https://books.toscrape.com/catalogue/one-with-you-crossfire-5_626/index.html,£15.71,Four
No Love Allowed (Dodge Cove #1),https://books.toscrape.com/catalogue/no-love-allowed-dodge-cove-1_625/index.html,£54.65,Four
Murder at the 42nd Street Library (Raymond Ambler #1),https://books.toscrape.com/catalogue/murder-at-the-42nd-street-library-raymond-ambler-1_624/index.html,£54.36,Four
Most Wanted,https://books.toscrape.com/catalogue/most-wanted_623/index.html,£35.28,Three
"Love, Lies and Spies",https://books.toscrape.com/catalogue/love-lies-and-spies_622/index.html,£20.55,Two
How to Speak Golf: An Illustrated Guide to Links Lingo,https://books.toscrape.com/catalogue/how-to-speak-golf-an-illustrated-guide-to-links-lingo_621/index.html,£58.32,Five
Girl in the Blue Coat,https://books.toscrape.com/catalogue/girl-in-the-blue-coat_160/index.html,£46.83,Two
"Fruits Basket, Vol. 3 (Fruits Basket #3)",https://books.toscrape.com/catalogue/fruits-basket-vol-3-fruits-basket-3_159/index.html,£45.17,Two
"Friday Night Lights: A Town, a Team, and a Dream",https://books.toscrape.com/catalogue/friday-night-lights-a-town-a-team-and-a-dream_158/index.html,£51.22,Three
Fire Bound (Sea Haven/Sisters of the Heart #5),https://books.toscrape.com/catalogue/fire-bound-sea-havensisters-of-the-heart-5_157/index.html,£21.28,Four
Fifty Shades Freed (Fifty Shades #3),https://books.toscrape.com/catalogue/fifty-shades-freed-fifty-shades-3_156/index.html,£15.36,Five
Fellside,https://books.toscrape.com/catalogue/fellside_155/index.html,£38.62,One
Extreme Prey (Lucas Davenport #26),https://books.toscrape.com/catalogue/extreme-prey-lucas-davenport-26_154/index.html,£25.40,Three
Eragon (The Inheritance Cycle #1),https://books.toscrape.com/catalogue/eragon-the-inheritance-cycle-1_153/index.html,£43.87,Three
Eclipse (Twilight #3),https://books.toscrape.com/catalogue/eclipse-twilight-3_152/index.html,£18.74,One
Dune (Dune #1),https://books.toscrape.com/catalogue/dune-dune-1_151/index.html,£54.86,One
Dracula,https://books.toscrape.com/catalogue/dracula_150/index.html,£52.62,Three
Do Androids Dream of Electric Sheep? (Blade Runner #1),https://books.toscrape.com/catalogue/do-androids-dream-of-electric-sheep-blade-runner-1_149/index.html,£51.48,One
Disrupted: My Misadventure in the Start-Up Bubble,https://books.toscrape.com/catalogue/disrupted-my-misadventure-in-the-start-up-bubble_148/index.html,£15.28,Five
Dead Wake: The Last Crossing of the Lusitania,https://books.toscrape.com/catalogue/dead-wake-the-last-crossing-of-the-lusitania_147/index.html,£39.24,Five
"David and Goliath: Underdogs, Misfits, and the Art of Battling Giants",https://books.toscrape.com/catalogue/david-and-goliath-underdogs-misfits-and-the-art-of-battling-giants_146/index.html,£17.81,One
Darkfever (Fever #1),https://books.toscrape.com/catalogue/darkfever-fever-1_145/index.html,£56.02,One
Dark Places,https://books.toscrape.com/catalogue/dark-places_144/index.html,£23.90,Five
Crazy Rich Asians (Crazy Rich Asians #1),https://books.toscrape.com/catalogue/crazy-rich-asians-crazy-rich-asians-1_143/index.html,£49.13,Five
Counting Thyme,https://books.toscrape.com/catalogue/counting-thyme_142/index.html,£10.62,One
Cosmos,https://books.toscrape.com/catalogue/cosmos_141/index.html,£36.17,Two
Roller Girl,https://books.toscrape.com/catalogue/roller-girl_540/index.html,£14.10,Five
Rising Strong,https://books.toscrape.com/catalogue/rising-strong_539/index.html,£21.82,Three
Proofs of God: Classical Arguments from Tertullian to Barth,https://books.toscrape.com/catalogue/proofs-of-god-classical-arguments-from-tertullian-to-barth_538/index.html,£54.21,One
Please Kill Me: The Uncensored Oral History of Punk,https://books.toscrape.com/catalogue/please-kill-me-the-uncensored-oral-history-of-punk_537/index.html,£31.19,Four
Out of Print: City Lights Spotlight No. 14,https://books.toscrape.com/catalogue/out-of-print-city-lights-spotlight-no-14_536/index.html,£53.64,Five
My Life Next Door (My Life Next Door ),https://books.toscrape.com/catalogue/my-life-next-door-my-life-next-door_535/index.html,£36.39,Five
Miller's Valley,https://books.toscrape.com/catalogue/millers-valley_534/index.html,£58.54,Two
Man's Search for Meaning,https://books.toscrape.com/catalogue/mans-search-for-meaning_533/index.html,£29.48,Three
"Love That Boy: What Two Presidents, Eight Road Trips, and My Son Taught Me About a Parent's Expectations",https://books.toscrape.com/catalogue/love-that-boy-what-two-presidents-eight-road-trips-and-my-son-taught-me-about-a-parents-expectations_532/index.html,£25.06,Two
Living Forward: A Proven Plan to Stop Drifting and Get the Life You Want,https://books.toscrape.com/catalogue/living-forward-a-proven-plan-to-stop-drifting-and-get-the-life-you-want_531/index.html,£12.55,Three
Les Fleurs du Mal,https://books.toscrape.com/catalogue/les-fleurs-du-mal_530/index.html,£29.04,Five
Left Behind (Left Behind #1),https://books.toscrape.com/catalogue/left-behind-left-behind-1_529/index.html,£40.72,Two
Kill 'Em and Leave: Searching for James Brown and the American Soul,https://books.toscrape.com/catalogue/kill-em-and-leave-searching-for-james-brown-and-the-american-soul_528/index.html,£45.05,Five
Kierkegaard: A Christian Missionary to Christians,https://books.toscrape.com/catalogue/kierkegaard-a-christian-missionary-to-christians_527/index.html,£47.13,One
John Vassos: Industrial Design for Modern Life,https://books.toscrape.com/catalogue/john-vassos-industrial-design-for-modern-life_526/index.html,£20.22,Four
I'll Give You the Sun,https://books.toscrape.com/catalogue/ill-give-you-the-sun_525/index.html,£56.48,One
I Will Find You,https://books.toscrape.com/catalogue/i-will-find-you_524/index.html,£44.21,One
Hystopia: A Novel,https://books.toscrape.com/catalogue/hystopia-a-novel_523/index.html,£21.96,Four
Howl and Other Poems,https://books.toscrape.com/catalogue/howl-and-other-poems_522/index.html,£40.45,Two
History of Beauty,https://books.toscrape.com/catalogue/history-of-beauty_521/index.html,£10.29,Four
Annie on My Mind,https://books.toscrape.com/catalogue/annie-on-my-mind_120/index.html,£36.83,Five
And Then There Were None,https://books.toscrape.com/catalogue/and-then-there-were-none_119/index.html,£35.01,Two
A Walk in the Woods: Rediscovering America on the Appalachian Trail,https://books.toscrape.com/catalogue/a-walk-in-the-woods-rediscovering-america-on-the-appalachian-trail_118/index.html,£30.48,Four
A Visit from the Goon Squad,https://books.toscrape.com/catalogue/a-visit-from-the-goon-squad_117/index.html,£14.08,Five
A Storm of Swords (A Song of Ice and Fire #3),https://books.toscrape.com/catalogue/a-storm-of-swords-a-song-of-ice-and-fire-3_116/index.html,£31.22,Two
A Heartbreaking Work of Staggering Genius,https://books.toscrape.com/catalogue/a-heartbreaking-work-of-staggering-genius_115/index.html,£54.29,Five
8 Keys to Mental Health Through Exercise,https://books.toscrape.com/catalogue/8-keys-to-mental-health-through-exercise_114/index.html,£31.04,One
#GIRLBOSS,https://books.toscrape.com/catalogue/girlboss_113/index.html,£50.96,One
"The Suffragettes (Little Black Classics, #96)",https://books.toscrape.com/catalogue/the-suffragettes-little-black-classics-96_112/index.html,£11.89,Two
The Sense of an Ending,https://books.toscrape.com/catalogue/the-sense-of-an-ending_111/index.html,£31.38,Three
"The Sandman, Vol. 2: The Doll's House (The Sandman (volumes) #2)",https://books.toscrape.com/catalogue/the-sandman-vol-2-the-dolls-house-the-sandman-volumes-2_110/index.html,£54.81,One
The Course of Love,https://books.toscrape.com/catalogue/the-course-of-love_109/index.html,£16.78,Three
Sugar Rush (Offensive Line #2),https://books.toscrape.com/catalogue/sugar-rush-offensive-line-2_108/index.html,£24.42,One
"Saga, Volume 2 (Saga (Collected Editions) #2)",https://books.toscrape.com/catalogue/saga-volume-2-saga-collected-editions-2_107/index.html,£11.75,Three
"Run, Spot, Run: The Ethics of Keeping Pets",https://books.toscrape.com/catalogue/run-spot-run-the-ethics-of-keeping-pets_106/index.html,£20.02,One
New Moon (Twilight #2),https://books.toscrape.com/catalogue/new-moon-twilight-2_105/index.html,£12.86,Four
Life,https://books.toscrape.com/catalogue/life_104/index.html,£31.58,Five
Kindle Paperwhite User's Guide,https://books.toscrape.com/catalogue/kindle-paperwhite-users-guide_103/index.html,£34.00,Three
H is for Hawk,https://books.toscrape.com/catalogue/h-is-for-hawk_102/index.html,£57.42,Five
Girl Online On Tour (Girl Online #2),https://books.toscrape.com/catalogue/girl-online-on-tour-girl-online-2_101/index.html,£53.47,One
Modern Romance,https://books.toscrape.com/catalogue/modern-romance_820/index.html,£28.26,Five
Miss Peregrine’s Home for Peculiar Children (Miss Peregrine’s Peculiar Children #1),https://books.toscrape.com/catalogue/miss-peregrines-home-for-peculiar-children-miss-peregrines-peculiar-children-1_819/index.html,£10.76,One
Louisa: The Extraordinary Life of Mrs. Adams,https://books.toscrape.com/catalogue/louisa-the-extraordinary-life-of-mrs-adams_818/index.html,£16.85,Two
Little Red,https://books.toscrape.com/catalogue/little-red_817/index.html,£13.47,Three
Library of Souls (Miss Peregrine’s Peculiar Children #3),https://books.toscrape.com/catalogue/library-of-souls-miss-peregrines-peculiar-children-3_816/index.html,£48.56,Five
Large Print Heart of the Pride,https://books.toscrape.com/catalogue/large-print-heart-of-the-pride_815/index.html,£19.15,Two
I Had a Nice Time And Other Lies...: How to find love & sh*t like that,https://books.toscrape.com/catalogue/i-had-a-nice-time-and-other-lies-how-to-find-love-sht-like-that_814/index.html,£57.36,Four
Hollow City (Miss Peregrine’s Peculiar Children #2),https://books.toscrape.com/catalogue/hollow-city-miss-peregrines-peculiar-children-2_813/index.html,£42.98,One
Grumbles,https://books.toscrape.com/catalogue/grumbles_812/index.html,£22.16,Two
Full Moon over Noah’s Ark: An Odyssey to Mount Ararat and Beyond,https://books.toscrape.com/catalogue/full-moon-over-noahs-ark-an-odyssey-to-mount-ararat-and-beyond_811/index.html,£49.43,Four
Frostbite (Vampire Academy #2),https://books.toscrape.com/catalogue/frostbite-vampire-academy-2_810/index.html,£29.99,Five
Follow You Home,https://books.toscrape.com/catalogue/follow-you-home_809/index.html,£21.36,One
First Steps for New Christians (Print Edition),https://books.toscrape.com/catalogue/first-steps-for-new-christians-print-edition_808/index.html,£29.00,One
Finders Keepers (Bill Hodges Trilogy #2),https://books.toscrape.com/catalogue/finders-keepers-bill-hodges-trilogy-2_807/index.html,£53.53,Five
"Fables, Vol. 1: Legends in Exile (Fables #1)",https://books.toscrape.com/catalogue/fables-vol-1-legends-in-exile-fables-1_806/index.html,£41.62,Four
Eureka Trivia 6.0,https://books.toscrape.com/catalogue/eureka-trivia-60_805/index.html,£54.59,Four
Drive: The Surprising Truth About What Motivates Us,https://books.toscrape.com/catalogue/drive-the-surprising-truth-about-what-motivates-us_804/index.html,£34.95,Four
Done Rubbed Out (Reightman & Bailey #1),https://books.toscrape.com/catalogue/done-rubbed-out-reightman-bailey-1_803/index.html,£37.72,Five
